C1: ATTACK TIME | H1: RELEASE / DECAY TIME | M1: SUSTAIN LEVEL | P1: ATTACK RATE | U1: DECAY/RELEASE RATE | Z1: SUSTAIN LEVEL
A2: value | C2: scale | D2: log2(sec) | E2: log10(sec) | F2: sec | H2: scale | I2: log2(sec) | J2: log10(sec) | K2: sec | M2: scale | N2: percent % | P2: raw data | Q2: times | R2: sec | S2: scale | U2: raw data | V2: times | W2: sec | X2: scale | Z2: raw data | AA2: percent % | AB2: scale
A3: 127 | C3: -596462174 | D3: =C3/1200/65536 -> -7.5844087473551429 | E3: =D3*LOG(2,10) -> -2.2831345323301795 | F3: =POWER(2, D3) -> 5.2103328450913023E-3 | H3: -783741166 | I3: =H3/1200/65536 -> -9.965784276326497 | J3: =I3*LOG(2,10) -> -2.999999997490737 | K3: =POWER(2, I3) -> 1.0000000057777908E-3 | M3: 65536000 | N3: =M3/655360 -> 100.00 | P3: 0 | Q3: 1 | R3: =174592/33513982*Q3 -> 5.2095271758515593E-3 | S3: =LOG(R3,2)*1200*65536 -> -596479719.29239154 | U3: 65535 | V3: =92544/U3 -> 1.4121309224078737 | W3: =174592/33513982*V3 -> 7.3565344161441483E-3 | X3: =LOG(W3,2)*1200*65536 -> -557325326.46141994 | Z3: 0 | AA3: =(92544+Z3)/92544 * 100 -> 100.00 | AB3: =AA3*655360 -> 65536000
A4: 126 | C4: -471815651 | D4: =C4/1200/65536 -> -5.9994462458292643 | E4: =D4*LOG(2,10) -> -1.8060132773682713 | F4: =POWER(2, D4) -> 1.5630998543992743E-2 | H4: -393172451 | I4: =H4/1200/65536 -> -4.9994462458292643 | J4: =I4*LOG(2,10) -> -1.5049832817042903 | K4: =POWER(2, I4) -> 3.1261997087985473E-2 | M4: 65527792 | N4: =M4/655360 -> 99.987475585937503 | P4: 1 | Q4: =-LOG(92544,2)/(LOG(P4,2)-8) -> 2.0622314796188896 | R4: =174592/33513982*Q4 -> 1.0743250935971177E-2 | S4: =LOG(R4,2)*1200*65536 -> -514359995.95651895 | U4: 15360 | V4: =92544/U4 -> 6.0250000000000004 | W4: =174592/33513982*V4 -> 3.1387401234505646E-2 | X4: =LOG(W4,2)*1200*65536 -> -392718236.19723719 | Z4: -128 | AA4: =(92544+Z4)/92544 * 100 -> 99.861687413554634 | AB4: =AA4*655360 -> 65445355.463347167
A5: 125 | C5: -471815651 | D5: =C5/1200/65536 -> -5.9994462458292643 | E5: =D5*LOG(2,10) -> -1.8060132773682713 | F5: =POWER(2, D5) -> 1.5630998543992743E-2 | H5: -314529251 | I5: =H5/1200/65536 -> -3.9994462458292643 | J5: =I5*LOG(2,10) -> -1.203953286040309 | K5: =POWER(2, I5) -> 6.2523994175970946E-2 | M5: 65511344 | N5: =M5/655360 -> 99.962377929687506 | P5: 5 | Q5: =-LOG(92544,2)/(LOG(P5,2)-8) -> 2.9055376741700214 | R5: =174592/33513982*Q5 -> 1.5136477474049259E-2 | S5: =LOG(R5,2)*1200*65536 -> -475463157.23530048 | U5: =7680/(126-A5) -> 7680 | V5: =92544/U5 -> 12.05 | W5: =174592/33513982*V5 -> 6.2774802469011293E-2 | X5: =LOG(W5,2)*1200*65536 -> -314075036.19723719 | Z5: -384 | AA5: =(92544+Z5)/92544 * 100 -> 99.585062240663902 | AB5: =AA5*655360 -> 65264066.390041493
A6: 124 | C6: -439175774 | D6: =C6/1200/65536 -> -5.5844087473551429 | E6: =D6*LOG(2,10) -> -1.681074541002217 | F6: =POWER(2, D6) -> 2.0841331380365209E-2 | H6: -235886051 | I6: =H6/1200/65536 -> -2.9994462458292643 | J6: =I6*LOG(2,10) -> -0.90292329037632801 | K6: =POWER(2, I6) -> 0.12504798835194192 | M6: 65503103 | N6: =M6/655360 -> 99.949803161621091 | P6: 14 | Q6: =-LOG(92544,2)/(LOG(P6,2)-8) -> 3.9349507364090277 | R6: =174592/33513982*Q6 -> 2.0499232796959935E-2 | S6: =LOG(R6,2)*1200*65536 -> -441053579.04449403 | U6: =7680/(126-A6) -> 3840 | V6: =92544/U6 -> 24.1 | W6: =174592/33513982*V6 -> 0.12554960493802259 | X6: =LOG(W6,2)*1200*65536 -> -235431836.19723719 | Z6: -512 | AA6: =(92544+Z6)/92544 * 100 -> 99.446749654218536 | AB6: =AA6*655360 -> 65173421.85338866
A7: 123 | C7: -413858319 | D7: =C7/1200/65536 -> -5.2624806594848632 | E7: =D7*LOG(2,10) -> -1.584164530106513 | F7: =POWER(2, D7) -> 2.6051664098744577E-2 | H7: -189882728 | I7: =H7/1200/65536 -> -2.4144837443033853 | J7: =I7*LOG(2,10) -> -0.726832031078401 | K7: =POWER(2, I7) -> 0.18757198263253885 | M7: 65486586 | N7: =M7/655360 -> 99.924600219726557 | P7: 26 | Q7: =-LOG(92544,2)/(LOG(P7,2)-8) -> 5.0000152831445019 | R7: =174592/33513982*Q7 -> 2.6047715497214411E-2 | S7: =LOG(R7,2)*1200*65536 -> -413875516.94160134 | U7: =7680/(126-A7) -> 2560 | V7: =92544/U7 -> 36.15 | W7: =174592/33513982*V7 -> 0.18832440740703385 | X7: =LOG(W7,2)*1200*65536 -> -189428513.26052323 | Z7: -768 | AA7: =(92544+Z7)/92544 * 100 -> 99.170124481327804 | AB7: =AA7*655360 -> 64992132.780082986
A8: 122 | C8: -393172451 | D8: =C8/1200/65536 -> -4.9994462458292643 | E8: =D8*LOG(2,10) -> -1.5049832817042903 | F8: =POWER(2, D8) -> 3.1261997087985473E-2 | H8: -157242851 | I8: =H8/1200/65536 -> -1.9994462458292643 | J8: =I8*LOG(2,10) -> -0.60189329471234687 | K8: =POWER(2, I8) -> 0.25009597670388378 | M8: 65478310 | N8: =M8/655360 -> 99.911972045898438 | P8: 38 | Q8: =-LOG(92544,2)/(LOG(P8,2)-8) -> 5.9947010544022339 | R8: =174592/33513982*Q8 -> 3.1229558054014433E-2 | S8: =LOG(R8,2)*1200*65536 -> -393290242.06008369 | U8: =7680/(126-A8) -> 1920 | V8: =92544/U8 -> 48.2 | W8: =174592/33513982*V8 -> 0.25109920987604517 | X8: =LOG(W8,2)*1200*65536 -> -156788636.19723719 | Z8: -896 | AA8: =(92544+Z8)/92544 * 100 -> 99.031811894882438 | AB8: =AA8*655360 -> 64901488.243430153
A9: 121 | C9: -375682800 | D9: =C9/1200/65536 -> -4.7770538330078125 | E9: =D9*LOG(2,10) -> -1.4380364946369464 | F9: =POWER(2, D9) -> 3.6472329720718052E-2 | H9: -131925396 | I9: =H9/1200/65536 -> -1.6775181579589844 | J9: =I9*LOG(2,10) -> -0.5049832838166427 | K9: =POWER(2, I9) -> 0.31261996935931158 | M9: 65470023 | N9: =M9/655360 -> 99.899327087402341 | P9: 51 | Q9: =-LOG(92544,2)/(LOG(P9,2)-8) -> 7.0880011431835586 | R9: =174592/33513982*Q9 -> 3.6925134577881664E-2 | S9: =LOG(R9,2)*1200*65536 -> -374282886.37169433 | U9: =7680/(126-A9) -> 1536 | V9: =92544/U9 -> 60.25 | W9: =174592/33513982*V9 -> 0.31387401234505646 | X9: =LOG(W9,2)*1200*65536 -> -131471180.6453914 | Z9: -1024 | AA9: =(92544+Z9)/92544 * 100 -> 98.893499308437072 | AB9: =AA9*655360 -> 64810843.706777319
A10: 120 | C10: -360532574 | D10: =C10/1200/65536 -> -4.5844087473551429 | E10: =D10*LOG(2,10) -> -1.380044545338236 | F10: =POWER(2, D10) -> 4.1682662760730418E-2 | H10: -111239528 | I10: =H10/1200/65536 -> -1.4144837443033855 | J10: =I10*LOG(2,10) -> -0.42580203541441997 | K10: =POWER(2, I10) -> 0.37514396526507765 | M10: 65453414 | N10: =M10/655360 -> 99.873983764648443 | P10: 63 | Q10: =-LOG(92544,2)/(LOG(P10,2)-8) -> 8.156270375037451 | R10: =174592/33513982*Q10 -> 4.2490312172350587E-2 | S10: =LOG(R10,2)*1200*65536 -> -358355218.99474603 | U10: =7680/(126-A10) -> 1280 | V10: =92544/U10 -> 72.3 | W10: =174592/33513982*V10 -> 0.3766488148140677 | X10: =LOG(W10,2)*1200*65536 -> -110785313.2605232 | Z10: -1280 | AA10: =(92544+Z10)/92544 * 100 -> 98.61687413554634 | AB10: =AA10*655360 -> 64629554.633471653
A11: 119 | C11: -347169128 | D11: =C11/1200/65536 -> -4.4144837443033857 | E11: =D11*LOG(2,10) -> -1.3288920224063634 | F11: =POWER(2, D11) -> 4.6892995658134699E-2 | H11: -93749877 | I11: =H11/1200/65536 -> -1.1920913314819337 | J11: =I11*LOG(2,10) -> -0.35885524834707599 | K11: =POWER(2, I11) -> 0.43766795689274396 | M11: 65445091 | N11: =M11/655360 -> 99.861283874511713 | P11: 73 | Q11: =-LOG(92544,2)/(LOG(P11,2)-8) -> 9.113951864656638 | R11: =174592/33513982*Q11 -> 4.7479379918331746E-2 | S11: =LOG(R11,2)*1200*65536 -> -345759161.74922001 | U11: =7680/(126-A11) -> 1097.1428571428571 | V11: =92544/U11 -> 84.35 | W11: =174592/33513982*V11 -> 0.43942361728307905 | X11: =LOG(W11,2)*1200*65536 -> -93295661.590876639 | Z11: -1408 | AA11: =(92544+Z11)/92544 * 100 -> 98.478561549100974 | AB11: =AA11*655360 -> 64538910.096818812
A12: 118 | C12: -335215119 | D12: =C12/1200/65536 -> -4.2624806594848632 | E12: =D12*LOG(2,10) -> -1.2831345344425318 | F12: =POWER(2, D12) -> 5.2103328197489154E-2 | H12: -78599651 | I12: =H12/1200/65536 -> -0.99944624582926433 | J12: =I12*LOG(2,10) -> -0.30086329904836567 | K12: =POWER(2, I12) -> 0.50019195340776756 | M12: 65428412 | N12: =M12/655360 -> 99.835833740234378 | P12: 84 | Q12: =-LOG(92544,2)/(LOG(P12,2)-8) -> 10.261883826262785 | R12: =174592/33513982*Q12 -> 5.345956266834756E-2 | S12: =LOG(R12,2)*1200*65536 -> -332299618.55757713 | U12: =7680/(126-A12) -> 960 | V12: =92544/U12 -> 96.4 | W12: =174592/33513982*V12 -> 0.50219841975209034 | X12: =LOG(W12,2)*1200*65536 -> -78145436.197237208 | Z12: -1664 | AA12: =(92544+Z12)/92544 * 100 -> 98.201936376210227 | AB12: =AA12*655360 -> 64357621.023513138
A13: 117 | C13: -324401402 | D13: =C13/1200/65536 -> -4.1249771372477211 | E13: =D13*LOG(2,10) -> -1.2417418497397028 | F13: =POWER(2, D13) -> 5.7313660957139662E-2 | H13: -65236205 | I13: =H13/1200/65536 -> -0.8295212427775065 | J13: =I13*LOG(2,10) -> -0.24971077611649303 | K13: =POWER(2, I13) -> 0.56271594821149462 | M13: 65420055 | N13: =M13/655360 -> 99.823081970214844 | P13: 92 | Q13: =-LOG(92544,2)/(LOG(P13,2)-8) -> 11.17409017237989 | R13: =174592/33513982*Q13 -> 5.8211726418428866E-2 | S13: =LOG(R13,2)*1200*65536 -> -322637375.84307259 | U13: =7680/(126-A13) -> 853.33333333333337 | V13: =92544/U13 -> 108.45 | W13: =174592/33513982*V13 -> 0.56497322222110158 | X13: =LOG(W13,2)*1200*65536 -> -64781990.323809162 | Z13: -1792 | AA13: =(92544+Z13)/92544 * 100 -> 98.063623789764861 | AB13: =AA13*655360 -> 64266976.486860298
A14: 116 | C14: -314529251 | D14: =C14/1200/65536 -> -3.9994462458292643 | E14: =D14*LOG(2,10) -> -1.203953286040309 | F14: =POWER(2, D14) -> 6.2523994175970946E-2 | H14: -53282196 | I14: =H14/1200/65536 -> -0.6775181579589844 | J14: =I14*LOG(2,10) -> -0.20395328815266156 | K14: =POWER(2, I14) -> 0.62523993871862305 | M14: 65403304 | N14: =M14/655360 -> 99.797521972656256 | P14: 100 | Q14: =-LOG(92544,2)/(LOG(P14,2)-8) -> 12.165267217648982 | R14: =174592/33513982*Q14 -> 6.3375290171838461E-2 | S14: =LOG(R14,2)*1200*65536 -> -312994882.55159438 | U14: =7680/(126-A14) -> 768 | V14: =92544/U14 -> 120.5 | W14: =174592/33513982*V14 -> 0.62774802469011293 | X14: =LOG(W14,2)*1200*65536 -> -52827980.645391405 | Z14: -2048 | AA14: =(92544+Z14)/92544 * 100 -> 97.786998616874129 | AB14: =AA14*655360 -> 64085687.413554631
A15: 115 | C15: -305447753 | D15: =C15/1200/65536 -> -3.8839690272013345 | E15: =D15*LOG(2,10) -> -1.1691911794174548 | F15: =POWER(2, D15) -> 6.7734327080683651E-2 | H15: -42468479 | I15: =H15/1200/65536 -> -0.5400146357218425 | J15: =I15*LOG(2,10) -> -0.16256060344983261 | K15: =POWER(2, I15) -> 0.68776393186930418 | M15: 65394911 | N15: =M15/655360 -> 99.784715270996088 | P15: 109 | Q15: =-LOG(92544,2)/(LOG(P15,2)-8) -> 13.393117305447067 | R15: =174592/33513982*Q15 -> 6.9771808572094307E-2 | S15: =LOG(R15,2)*1200*65536 -> -302085200.34954423 | U15: =7680/(126-A15) -> 698.18181818181813 | V15: =92544/U15 -> 132.55 | W15: =174592/33513982*V15 -> 0.69052282715912428 | X15: =LOG(W15,2)*1200*65536 -> -42014263.526420511 | Z15: -2176 | AA15: =(92544+Z15)/92544 * 100 -> 97.648686030428763 | AB15: =AA15*655360 -> 63995042.87690179
A16: 114 | C16: -297039600 | D16: =C16/1200/65536 -> -3.7770538330078125 | E16: =D16*LOG(2,10) -> -1.1370064989729651 | F16: =POWER(2, D16) -> 7.2944659441436105E-2 | H16: -32596328 | I16: =H16/1200/65536 -> -0.41448374430338542 | J16: =I16*LOG(2,10) -> -0.12477203975043878 | K16: =POWER(2, I16) -> 0.75028793053015541 | M16: 65378090 | N16: =M16/655360 -> 99.759048461914063 | P16: 116 | Q16: =-LOG(92544,2)/(LOG(P16,2)-8) -> 14.446214788513128 | R16: =174592/33513982*Q16 -> 7.5257948528947821E-2 | S16: =LOG(R16,2)*1200*65536 -> -293497383.93403953 | U16: =7680/(126-A16) -> 640 | V16: =92544/U16 -> 144.6 | W16: =174592/33513982*V16 -> 0.7532976296281354 | X16: =LOG(W16,2)*1200*65536 -> -32142113.260523196 | Z16: -2432 | AA16: =(92544+Z16)/92544 * 100 -> 97.372060857538031 | AB16: =AA16*655360 -> 63813753.803596124
A17: 113 | C17: -289211796 | D17: =C17/1200/65536 -> -3.6775181579589842 | E17: =D17*LOG(2,10) -> -1.1070432751446049 | F17: =POWER(2, D17) -> 7.8154992339827908E-2 | H17: -23514830 | I17: =H17/1200/65536 -> -0.29900652567545571 | J17: =I17*LOG(2,10) -> -9.0009933127584499E-2 | K17: =POWER(2, I17) -> 0.81281192542158331 | M17: 65369661 | N17: =M17/655360 -> 99.746186828613276 | P17: 123 | Q17: =-LOG(92544,2)/(LOG(P17,2)-8) -> 15.601019513032284 | R17: =174592/33513982*Q17 -> 8.1273935124132141E-2 | S17: =LOG(R17,2)*1200*65536 -> -284772016.43198562 | U17: =7680/(126-A17) -> 590.76923076923072 | V17: =92544/U17 -> 156.65 | W17: =174592/33513982*V17 -> 0.81607243209714675 | X17: =LOG(W17,2)*1200*65536 -> -23060615.355523683 | Z17: -2560 | AA17: =(92544+Z17)/92544 * 100 -> 97.233748271092665 | AB17: =AA17*655360 -> 63723109.266943291
A18: 112 | C18: -281889374 | D18: =C18/1200/65536 -> -3.5844087473551434 | E18: =D18*LOG(2,10) -> -1.0790145496742549 | F18: =POWER(2, D18) -> 8.3365325521460823E-2 | H18: -15106677 | I18: =H18/1200/65536 -> -0.19209133148193358 | J18: =I18*LOG(2,10) -> -5.7825252683094831E-2 | K18: =POWER(2, I18) -> 0.87533591378548792 | M18: 65352768 | N18: =M18/655360 -> 99.720410156249997 | P18: 127 | Q18: =-LOG(92544,2)/(LOG(P18,2)-8) -> 16.313262165777576 | R18: =174592/33513982*Q18 -> 8.4984382579409351E-2 | S18: =LOG(R18,2)*1200*65536 -> -279707001.46340263 | U18: =7680/(126-A18) -> 548.57142857142856 | V18: =92544/U18 -> 168.7 | W18: =174592/33513982*V18 -> 0.8788472345661581 | X18: =LOG(W18,2)*1200*65536 -> -14652461.590876639 | Z18: -2816 | AA18: =(92544+Z18)/92544 * 100 -> 96.957123098201933 | AB18: =AA18*655360 -> 63541820.193637617
A19: 111 | C19: -275011017 | D19: =C19/1200/65536 -> -3.496945915222168 | E19: =D19*LOG(2,10) -> -1.0526856136965057 | F19: =POWER(2, D19) -> 8.8575657806782726E-2 | H19: -7278873 | I19: =H19/1200/65536 -> -9.2555656433105468E-2 | J19: =I19*LOG(2,10) -> -2.7862028854734669E-2 | K19: =POWER(2, I19) -> 0.93785990860106461 | M19: 65344303 | N19: =M19/655360 -> 99.707493591308591 | P19: 132 | Q19: =-LOG(92544,2)/(LOG(P19,2)-8) -> 17.264284545711746 | R19: =174592/33513982*Q19 -> 8.9938759512519437E-2 | S19: =LOG(R19,2)*1200*65536 -> -273278294.09397119 | U19: =7680/(126-A19) -> 512 | V19: =92544/U19 -> 180.75 | W19: =174592/33513982*V19 -> 0.94162203703516933 | X19: =LOG(W19,2)*1200*65536 -> -6824657.7086773738 | Z19: -2944 | AA19: =(92544+Z19)/92544 * 100 -> 96.818810511756567 | AB19: =AA19*655360 -> 63451175.656984784
A20: 110 | C20: -268525928 | D20: =C20/1200/65536 -> -3.4144837443033853 | E20: =D20*LOG(2,10) -> -1.0278620267423821 | F20: =POWER(2, D20) -> 9.378599131626944E-2 | H20: 43549 | I20: =H20/1200/65536 -> 5.5375417073567706E-4 | J20: =I20*LOG(2,10) -> 1.6669661561547234E-4 | K20: =POWER(2, I20) -> 1.0003839068155351 | M20: 65327337 | N20: =M20/655360 -> 99.681605529785159 | P20: 137 | Q20: =-LOG(92544,2)/(LOG(P20,2)-8) -> 18.290951956586191 | R20: =174592/33513982*Q20 -> 9.528721129003101E-2 | S20: =LOG(R20,2)*1200*65536 -> -266724200.15140718 | U20: =7680/(126-A20) -> 480 | V20: =92544/U20 -> 192.8 | W20: =174592/33513982*V20 -> 1.0043968395041807 | X20: =LOG(W20,2)*1200*65536 -> 497763.80276278837 | Z20: -3200 | AA20: =(92544+Z20)/92544 * 100 -> 96.542185338865835 | AB20: =AA20*655360 -> 63269886.58367911
A21: 109 | C21: -262391561 | D21: =C21/1200/65536 -> -3.3364812342325845 | E21: =D21*LOG(2,10) -> -1.0043809314739893 | F21: =POWER(2, D21) -> 9.8996324034706151E-2 | H21: 7476715 | I21: =H21/1200/65536 -> 9.5071347554524746E-2 | J21: =I21*LOG(2,10) -> 2.8619327342107429E-2 | K21: =POWER(2, I21) -> 1.0681182298411718 | M21: 65310323 | N21: =M21/655360 -> 99.655644226074216 | P21: 143 | Q21: =-LOG(92544,2)/(LOG(P21,2)-8) -> 19.637291952029589 | R21: =174592/33513982*Q21 -> 0.10230100608422926 | S21: =LOG(R21,2)*1200*65536 -> -258665959.50759825 | U21: =7680/(126-A21) -> 451.76470588235293 | V21: =92544/U21 -> 204.85 | W21: =174592/33513982*V21 -> 1.0671716419731918 | X21: =LOG(W21,2)*1200*65536 -> 7376121.5197814628 | Z21: -3456 | AA21: =(92544+Z21)/92544 * 100 -> 96.265560165975103 | AB21: =AA21*655360 -> 63088597.510373443
A22: 108 | C22: -256571919 | D22: =C22/1200/65536 -> -3.2624806594848632 | E22: =D22*LOG(2,10) -> -0.98210453877855075 | F22: =POWER(2, D22) -> 0.10420665639497827 | H22: 13931052 | I22: =H22/1200/65536 -> 0.17714248657226561 | J22: =I22*LOG(2,10) -> 5.3325201964755958E-2 | K22: =POWER(2, I22) -> 1.1306422285469861 | M22: 65301797 | N22: =M22/655360 -> 99.642634582519534 | P22: =255-A22 -> 147 | Q22: =-LOG(92544,2)/(LOG(P22,2)-8) -> 20.613871994187125 | R22: =174592/33513982*Q22 -> 0.10738852635324321 | S22: =LOG(R22,2)*1200*65536 -> -253159399.82893384 | U22: =7680/(126-A22) -> 426.66666666666669 | V22: =92544/U22 -> 216.9 | W22: =174592/33513982*V22 -> 1.1299464444422032 | X22: =LOG(W22,2)*1200*65536 -> 13861209.676190836 | Z22: -3584 | AA22: =(92544+Z22)/92544 * 100 -> 96.127247579529737 | AB22: =AA22*655360 -> 62997952.97372061
A23: 107 | C23: -251036277 | D23: =C23/1200/65536 -> -3.1920913314819335 | E23: =D23*LOG(2,10) -> -0.96091523967503822 | F23: =POWER(2, D23) -> 0.10941698922318599 | H23: 20037897 | I23: =H23/1200/65536 -> 0.25479503631591799 | J23: =I23*LOG(2,10) -> 7.6700948677384709E-2 | K23: =POWER(2, I23) -> 1.1931662178655265 | M23: 65284709 | N23: =M23/655360 -> 99.616560363769537 | P23: =255-A23 -> 148 | Q23: =-LOG(92544,2)/(LOG(P23,2)-8) -> 20.868916670648538 | R23: =174592/33513982*Q23 -> 0.1087171885263252 | S23: =LOG(R23,2)*1200*65536 -> -251764254.32928929 | U23: =7680/(126-A23) -> 404.21052631578948 | V23: =92544/U23 -> 228.95 | W23: =174592/33513982*V23 -> 1.1927212469112145 | X23: =LOG(W23,2)*1200*65536 -> 19995576.828009371 | Z23: -3840 | AA23: =(92544+Z23)/92544 * 100 -> 95.850622406639005 | AB23: =AA23*655360 -> 62816663.900414936
A24: 106 | C24: -251036277 | D24: =C24/1200/65536 -> -3.1920913314819335 | E24: =D24*LOG(2,10) -> -0.96091523967503822 | F24: =POWER(2, D24) -> 0.10941698922318599 | H24: 25832764 | I24: =H24/1200/65536 -> 0.32848058064778646 | J24: =I24*LOG(2,10) -> 9.8882507768105171E-2 | K24: =POWER(2, I24) -> 1.2556902085063746 | M24: 65276146 | N24: =M24/655360 -> 99.603494262695307 | P24: =255-A24 -> 149 | Q24: =-LOG(92544,2)/(LOG(P24,2)-8) -> 21.128569056559989 | R24: =174592/33513982*Q24 -> 0.1100698546870056 | S24: =LOG(R24,2)*1200*65536 -> -250361310.53829539 | U24: =7680/(126-A24) -> 384 | V24: =92544/U24 -> 241 | W24: =174592/33513982*V24 -> 1.2554960493802259 | X24: =LOG(W24,2)*1200*65536 -> 25815219.354608603 | Z24: -3968 | AA24: =(92544+Z24)/92544 * 100 -> 95.712309820193639 | AB24: =AA24*655360 -> 62726019.363762103
A25: 105 | C25: -251036277 | D25: =C25/1200/65536 -> -3.1920913314819335 | E25: =D25*LOG(2,10) -> -0.96091523967503822 | F25: =POWER(2, D25) -> 0.10941698922318599 | H25: 31345986 | I25: =H25/1200/65536 -> 0.39858482360839842 | J25: =I25*LOG(2,10) -> 0.11998598772256487 | K25: =POWER(2, I25) -> 1.3182142063992344 | M25: 65258984 | N25: =M25/655360 -> 99.577307128906256 | P25: =255-A25 -> 150 | Q25: =-LOG(92544,2)/(LOG(P25,2)-8) -> 21.392961205918578 | R25: =174592/33513982*Q25 -> 0.11144721277417098 | S25: =LOG(R25,2)*1200*65536 -> -248950362.63619134 | U25: =7680/(126-A25) -> 365.71428571428572 | V25: =92544/U25 -> 253.05 | W25: =174592/33513982*V25 -> 1.318270851849237 | X25: =LOG(W25,2)*1200*65536 -> 31350861.345837381 | Z25: -4224 | AA25: =(92544+Z25)/92544 * 100 -> 95.435684647302907 | AB25: =AA25*655360 -> 62544730.290456429
A26: 104 | C26: -251036277 | D26: =C26/1200/65536 -> -3.1920913314819335 | E26: =D26*LOG(2,10) -> -0.96091523967503822 | F26: =POWER(2, D26) -> 0.10941698922318599 | H26: 36603675 | I26: =H26/1200/65536 -> 0.46543979644775391 | J26: =I26*LOG(2,10) -> 0.14011133990651162 | K26: =POWER(2, I26) -> 1.3807381985440703 | M26: 65241772 | N26: =M26/655360 -> 99.551043701171878 | P26: =255-A26 -> 151 | Q26: =-LOG(92544,2)/(LOG(P26,2)-8) -> 21.662230175028707 | R26: =174592/33513982*Q26 -> 0.11284997678636373 | S26: =LOG(R26,2)*1200*65536 -> -247531200.03686529 | U26: =7680/(126-A26) -> 349.09090909090907 | V26: =92544/U26 -> 265.1 | W26: =174592/33513982*V26 -> 1.3810456543182486 | X26: =LOG(W26,2)*1200*65536 -> 36628936.473579496 | Z26: -4480 | AA26: =(92544+Z26)/92544 * 100 -> 95.15905947441216 | AB26: =AA26*655360 -> 62363441.217150755
A27: 103 | C27: -245758202 | D27: =C27/1200/65536 -> -3.1249771372477215 | E27: =D27*LOG(2,10) -> -0.94071185407572178 | F27: =POWER(2, D27) -> 0.11462732191427927 | H27: 41628474 | I27: =H27/1200/65536 -> 0.52933341979980464 | J27: =I27*LOG(2,10) -> 0.15934523706713549 | K27: =POWER(2, I27) -> 1.4432621991964845 | M27: 65233147 | N27: =M27/655360 -> 99.537882995605472 | P27: =255-A27 -> 152 | Q27: =-LOG(92544,2)/(LOG(P27,2)-8) -> 21.936518263673502 | R27: =174592/33513982*Q27 -> 0.11427888803817117 | S27: =LOG(R27,2)*1200*65536 -> -246103607.17828485 | U27: =7680/(126-A27) -> 333.91304347826087 | V27: =92544/U27 -> 277.15 | W27: =174592/33513982*V27 -> 1.4438204567872595 | X27: =LOG(W27,2)*1200*65536 -> 41672351.425345644 | Z27: -4608 | AA27: =(92544+Z27)/92544 * 100 -> 95.020746887966794 | AB27: =AA27*655360 -> 62272796.680497915
A28: 102 | C28: -245758202 | D28: =C28/1200/65536 -> -3.1249771372477215 | E28: =D28*LOG(2,10) -> -0.94071185407572178 | F28: =POWER(2, D28) -> 0.11462732191427927 | H28: 46440141 | I28: =H28/1200/65536 -> 0.59051692962646485 | J28: =I28*LOG(2,10) -> 0.17776330876496216 | K28: =POWER(2, I28) -> 1.5057861864709581 | M28: 65215860 | N28: =M28/655360 -> 99.511505126953125 | P28: =255-A28 -> 153 | Q28: =-LOG(92544,2)/(LOG(P28,2)-8) -> 22.21597327031516 | R28: =174592/33513982*Q28 -> 0.11573471648969867 | S28: =LOG(R28,2)*1200*65536 -> -244667363.30365419 | U28: =7680/(126-A28) -> 320 | V28: =92544/U28 -> 289.2 | W28: =174592/33513982*V28 -> 1.5065952592562708 | X28: =LOG(W28,2)*1200*65536 -> 46501086.7394768 | Z28: -4864 | AA28: =(92544+Z28)/92544 * 100 -> 94.744121715076062 | AB28: =AA28*655360 -> 62091507.607192248
A29: 101 | C29: -245758202 | D29: =C29/1200/65536 -> -3.1249771372477215 | E29: =D29*LOG(2,10) -> -0.94071185407572178 | F29: =POWER(2, D29) -> 0.11462732191427927 | H29: 51056025 | I29: =H29/1200/65536 -> 0.64921092987060547 | J29: =I29*LOG(2,10) -> 0.19543196340395752 | K29: =POWER(2, I29) -> 1.5683101868791065 | M29: 65198522 | N29: =M29/655360 -> 99.485049438476565 | P29: =255-A29 -> 154 | Q29: =-LOG(92544,2)/(LOG(P29,2)-8) -> 22.500748762286676 | R29: =174592/33513982*Q29 -> 0.11721826215414077 | S29: =LOG(R29,2)*1200*65536 -> -243222242.23272687 | U29: =7680/(126-A29) -> 307.2 | V29: =92544/U29 -> 301.25 | W29: =174592/33513982*V29 -> 1.5693700617252822 | X29: =LOG(W29,2)*1200*65536 -> 51132674.906454407 | Z29: -5120 | AA29: =(92544+Z29)/92544 * 100 -> 94.46749654218533 | AB29: =AA29*655360 -> 61910218.533886582
A30: 100 | C30: -245758202 | D30: =C30/1200/65536 -> -3.1249771372477215 | E30: =D30*LOG(2,10) -> -0.94071185407572178 | F30: =POWER(2, D30) -> 0.11462732191427927 | H30: 55491436 | I30: =H30/1200/65536 -> 0.70561009724934898 | J30: =I30*LOG(2,10) -> 0.21240980451543284 | K30: =POWER(2, I30) -> 1.6308341778818443 | M30: 65181133 | N30: =M30/655360 -> 99.458515930175778 | P30: =255-A30 -> 155 | Q30: =-LOG(92544,2)/(LOG(P30,2)-8) -> 22.791004362015116 | R30: =174592/33513982*Q30 -> 0.11873035658886917 | S30: =LOG(R30,2)*1200*65536 -> -241768012.12266037 | U30: =7680/(126-A30) -> 295.38461538461536 | V30: =92544/U30 -> 313.3 | W30: =174592/33513982*V30 -> 1.6321448641942935 | X30: =LOG(W30,2)*1200*65536 -> 55582584.644476317 | Z30: -5376 | AA30: =(92544+Z30)/92544 * 100 -> 94.190871369294598 | AB30: =AA30*655360 -> 61728929.460580908
A31: 99 | C31: -245758202 | D31: =C31/1200/65536 -> -3.1249771372477215 | E31: =D31*LOG(2,10) -> -0.94071185407572178 | F31: =POWER(2, D31) -> 0.11462732191427927 | H31: 59759958 | I31: =H31/1200/65536 -> 0.75988716125488276 | J31: =I31*LOG(2,10) -> 0.22874882885767231 | K31: =POWER(2, I31) -> 1.693358175469498 | M31: 65172420 | N31: =M31/655360 -> 99.445220947265625 | P31: =255-A31 -> 156 | Q31: =-LOG(92544,2)/(LOG(P31,2)-8) -> 23.086906050399374 | R31: =174592/33513982*Q31 -> 0.12027186447588734 | S31: =LOG(R31,2)*1200*65536 -> -240304435.21775588 | U31: =7680/(126-A31) -> 284.44444444444446 | V31: =92544/U31 -> 325.35 | W31: =174592/33513982*V31 -> 1.6949196666633046 | X31: =LOG(W31,2)*1200*65536 -> 59864532.612904862 | Z31: -5504 | AA31: =(92544+Z31)/92544 * 100 -> 94.052558782849232 | AB31: =AA31*655360 -> 61638284.923928075
A32: 98 | C32: -240714787 | D32: =C32/1200/65536 -> -3.0608467992146808 | E32: =D32*LOG(2,10) -> -0.92140669869570591 | F32: =POWER(2, D32) -> 0.11983765477951058 | H32: 63873695 | I32: =H32/1200/65536 -> 0.8121960322062175 | J32: =I32*LOG(2,10) -> 0.24449536805334035 | K32: =POWER(2, I32) -> 1.755882166823485 | M32: 65154954 | N32: =M32/655360 -> 99.418569946289068 | P32: =255-A32 -> 157 | Q32: =-LOG(92544,2)/(LOG(P32,2)-8) -> 23.388626488556046 | R32: =174592/33513982*Q32 -> 0.12184368529797435 | S32: =LOG(R32,2)*1200*65536 -> -238831267.58738574 | U32: =7680/(126-A32) -> 274.28571428571428 | V32: =92544/U32 -> 337.4 | W32: =174592/33513982*V32 -> 1.7576944691323162 | X32: =LOG(W32,2)*1200*65536 -> 63990738.409123361 | Z32: -5760 | AA32: =(92544+Z32)/92544 * 100 -> 93.7759336099585 | AB32: =AA32*655360 -> 61456995.850622401
A33: 97 | C33: -240714787 | D33: =C33/1200/65536 -> -3.0608467992146808 | E33: =D33*LOG(2,10) -> -0.92140669869570591 | F33: =POWER(2, D33) -> 0.11983765477951058 | H33: 68168111 | I33: =H33/1200/65536 -> 0.86680235544840489 | J33: =I33*LOG(2,10) -> 0.26093350930216197 | K33: =POWER(2, I33) -> 1.8236164843692635 | M33: 65137437 | N33: =M33/655360 -> 99.391841125488284 | P33: =255-A33 -> 158 | Q33: =-LOG(92544,2)/(LOG(P33,2)-8) -> 23.696345359245846 | R33: =174592/33513982*Q33 -> 0.12344675511735521 | S33: =LOG(R33,2)*1200*65536 -> -237348258.85136059 | U33: =7680/(126-A33) -> 264.82758620689657 | V33: =92544/U33 -> 349.45 | W33: =174592/33513982*V33 -> 1.8204692716013273 | X33: =LOG(W33,2)*1200*65536 -> 67972134.798779458 | Z33: -6016 | AA33: =(92544+Z33)/92544 * 100 -> 93.499308437067768 | AB33: =AA33*655360 -> 61275706.777316734
A34: 96 | C34: -240714787 | D34: =C34/1200/65536 -> -3.0608467992146808 | E34: =D34*LOG(2,10) -> -0.92140669869570591 | F34: =POWER(2, D34) -> 0.11983765477951058 | H34: 71679052 | I34: =H34/1200/65536 -> 0.91144627888997398 | J34: =I34*LOG(2,10) -> 0.27437266938220062 | K34: =POWER(2, I34) -> 1.8809301562408742 | M34: 65119868 | N34: =M34/655360 -> 99.365032958984372 | P34: =255-A34 -> 159 | Q34: =-LOG(92544,2)/(LOG(P34,2)-8) -> 24.010249729401735 | R34: =174592/33513982*Q34 -> 0.12508204846430088 | S34: =LOG(R34,2)*1200*65536 -> -235855151.8919349 | U34: =7680/(126-A34) -> 256 | V34: =92544/U34 -> 361.5 | W34: =174592/33513982*V34 -> 1.8832440740703387 | X34: =LOG(W34,2)*1200*65536 -> 71818542.291322634 | Z34: -6272 | AA34: =(92544+Z34)/92544 * 100 -> 93.222683264177036 | AB34: =AA34*655360 -> 61094417.70401106
A35: 95 | C35: -240714787 | D35: =C35/1200/65536 -> -3.0608467992146808 | E35: =D35*LOG(2,10) -> -0.92140669869570591 | F35: =POWER(2, D35) -> 0.11983765477951058 | H35: 75692956 | I35: =H35/1200/65536 -> 0.96248570760091146 | J35: =I35*LOG(2,10) -> 0.2897370683857462 | K35: =POWER(2, I35) -> 1.9486644774030026 | M35: 65111064 | N35: =M35/655360 -> 99.351599121093756 | P35: =255-A35 -> 160 | Q35: =-LOG(92544,2)/(LOG(P35,2)-8) -> 24.330534435297931 | R35: =174592/33513982*Q35 -> 0.12675058034367676 | S35: =LOG(R35,2)*1200*65536 -> -234351682.5515945 | U35: =7680/(126-A35) -> 247.74193548387098 | V35: =92544/U35 -> 373.55 | W35: =174592/33513982*V35 -> 1.94601887653935 | X35: =LOG(W35,2)*1200*65536 -> 75538815.079779893 | Z35: -6400 | AA35: =(92544+Z35)/92544 * 100 -> 93.08437067773167 | AB35: =AA35*655360 -> 61003773.167358227
A36: 94 | C36: -235886051 | D36: =C36/1200/65536 -> -2.9994462458292643 | E36: =D36*LOG(2,10) -> -0.90292329037632801 | F36: =POWER(2, D36) -> 0.12504798835194192 | H36: 78981829 | I36: =H36/1200/65536 -> 1.0043058904012043 | J36: =I36*LOG(2,10) -> 0.30232619783278525 | K36: =POWER(2, I36) -> 2.0059781483830794 | M36: 65093416 | N36: =M36/655360 -> 99.324670410156244 | P36: =255-A36 -> 161 | Q36: =-LOG(92544,2)/(LOG(P36,2)-8) -> 24.657402492028922 | R36: =174592/33513982*Q36 -> 0.12845340836813463 | S36: =LOG(R36,2)*1200*65536 -> -232837579.31570578 | U36: =7680/(126-A36) -> 240 | V36: =92544/U36 -> 385.6 | W36: =174592/33513982*V36 -> 2.0087936790083614 | X36: =LOG(W36,2)*1200*65536 -> 79140963.802762792 | Z36: -6656 | AA36: =(92544+Z36)/92544 * 100 -> 92.807745504840938 | AB36: =AA36*655360 -> 60822484.094052553
A37: 93 | C37: -235886051 | D37: =C37/1200/65536 -> -2.9994462458292643 | E37: =D37*LOG(2,10) -> -0.90292329037632801 | F37: =POWER(2, D37) -> 0.12504798835194192 | H37: 82749623 | I37: =H37/1200/65536 -> 1.0522158686319987 | J37: =I37*LOG(2,10) -> 0.31674853837186273 | K37: =POWER(2, I37) -> 2.0737124657968695 | M37: 65075716 | N37: =M37/655360 -> 99.297662353515619 | P37: =255-A37 -> 162 | Q37: =-LOG(92544,2)/(LOG(P37,2)-8) -> 24.991065529108464 | R37: =174592/33513982*Q37 -> 0.13019163502737768 | S37: =LOG(R37,2)*1200*65536 -> -231312562.97904488 | U37: =7680/(126-A37) -> 232.72727272727272 | V37: =92544/U37 -> 397.65 | W37: =174592/33513982*V37 -> 2.0715684814773727 | X37: =LOG(W37,2)*1200*65536 -> 82632259.410293519 | Z37: -6912 | AA37: =(92544+Z37)/92544 * 100 -> 92.531120331950206 | AB37: =AA37*655360 -> 60641195.020746887
A38: 92 | C38: -235886051 | D38: =C38/1200/65536 -> -2.9994462458292643 | E38: =D38*LOG(2,10) -> -0.90292329037632801 | F38: =POWER(2, D38) -> 0.12504798835194192 | H38: 86396305 | I38: =H38/1200/65536 -> 1.0985858281453451 | J38: =I38*LOG(2,10) -> 0.33070728708310437 | K38: =POWER(2, I38) -> 2.1414467871888681 | M38: 65057963 | N38: =M38/655360 -> 99.270573425292966 | P38: =255-A38 -> 163 | Q38: =-LOG(92544,2)/(LOG(P38,2)-8) -> 25.331744254157009 | R38: =174592/33513982*Q38 -> 0.13196641010375251 | S38: =LOG(R38,2)*1200*65536 -> -229776346.29514027 | U38: =7680/(126-A38) -> 225.88235294117646 | V38: =92544/U38 -> 409.7 | W38: =174592/33513982*V38 -> 2.1343432839463836 | X38: =LOG(W38,2)*1200*65536 -> 86019321.51978147 | Z38: -7168 | AA38: =(92544+Z38)/92544 * 100 -> 92.254495159059474 | AB38: =AA38*655360 -> 60459905.94744122
A39: 91 | C39: -231254463 | D39: =C39/1200/65536 -> -2.9405525588989256 | E39: =D39*LOG(2,10) -> -0.88519452405505228 | F39: =POWER(2, D39) -> 0.13025832100823687 | H39: 89392973 | I39: =H39/1200/65536 -> 1.1366904322306315 | J39: =I39*LOG(2,10) -> 0.34217791588567587 | K39: =POWER(2, I39) -> 2.1987604467269097 | M39: 65040156 | N39: =M39/655360 -> 99.243402099609369 | P39: =255-A39 -> 164 | Q39: =-LOG(92544,2)/(LOG(P39,2)-8) -> 25.679668946812821 | R39: =174592/33513982*Q39 -> 0.13377893324529277 | S39: =LOG(R39,2)*1200*65536 -> -228228633.60730079 | U39: =7680/(126-A39) -> 219.42857142857142 | V39: =92544/U39 -> 421.75 | W39: =174592/33513982*V39 -> 2.197118086415395 | X39: =LOG(W39,2)*1200*65536 -> 89308193.96096915 | Z39: -7424 | AA39: =(92544+Z39)/92544 * 100 -> 91.977869986168741 | AB39: =AA39*655360 -> 60278616.874135546
A40: 90 | C40: -231254463 | D40: =C40/1200/65536 -> -2.9405525588989256 | E40: =D40*LOG(2,10) -> -0.88519452405505228 | F40: =POWER(2, D40) -> 0.13025832100823687 | H40: 92574252 | I40: =H40/1200/65536 -> 1.1771424865722657 | J40: =I40*LOG(2,10) -> 0.35435519762873713 | K40: =POWER(2, I40) -> 2.2612844570939723 | M40: 65022296 | N40: =M40/655360 -> 99.216149902343744 | P40: =255-A40 -> 165 | Q40: =-LOG(92544,2)/(LOG(P40,2)-8) -> 26.035079985194454 | R40: =174592/33513982*Q40 -> 0.13563045670833951 | S40: =LOG(R40,2)*1200*65536 -> -226669120.4600971 | U40: =7680/(126-A40) -> 213.33333333333334 | V40: =92544/U40 -> 433.8 | W40: =174592/33513982*V40 -> 2.2598928888844063 | X40: =LOG(W40,2)*1200*65536 -> 92504409.676190838 | Z40: -7680 | AA40: =(92544+Z40)/92544 * 100 -> 91.701244813278009 | AB40: =AA40*655360 -> 60097327.800829872
A41: 89 | C41: -231254463 | D41: =C41/1200/65536 -> -2.9405525588989256 | E41: =D41*LOG(2,10) -> -0.88519452405505228 | F41: =POWER(2, D41) -> 0.13025832100823687 | H41: 95922862 | I41: =H41/1200/65536 -> 1.2197222646077475 | J41: =I41*LOG(2,10) -> 0.36717298802613146 | K41: =POWER(2, I41) -> 2.3290187668707891 | M41: 65004382 | N41: =M41/655360 -> 99.18881530761719 | P41: =255-A41 -> 166 | Q41: =-LOG(92544,2)/(LOG(P41,2)-8) -> 26.398228407445867 | R41: =174592/33513982*Q41 -> 0.13752228828292587 | S41: =LOG(R41,2)*1200*65536 -> -225097493.18998131 | U41: =7680/(126-A41) -> 207.56756756756758 | V41: =92544/U41 -> 445.85 | W41: =174592/33513982*V41 -> 2.3226676913534177 | X41: =LOG(W41,2)*1200*65536 -> 95613046.726593405 | Z41: -7936 | AA41: =(92544+Z41)/92544 * 100 -> 91.424619640387277 | AB41: =AA41*655360 -> 59916038.727524206
A42: 88 | C42: -231254463 | D42: =C42/1200/65536 -> -2.9405525588989256 | E42: =D42*LOG(2,10) -> -0.88519452405505228 | F42: =POWER(2, D42) -> 0.13025832100823687 | H42: 98681097 | I42: =H42/1200/65536 -> 1.2547950363159179 | J42: =I42*LOG(2,10) -> 0.37773094434136584 | K42: =POWER(2, I42) -> 2.3863324357310529 | M42: 64986413 | N42: =M42/655360 -> 99.161396789550778 | P42: =255-A42 -> 167 | Q42: =-LOG(92544,2)/(LOG(P42,2)-8) -> 26.769376511123156 | R42: =174592/33513982*Q42 -> 0.13945579441529848 | S42: =LOG(R42,2)*1200*65536 -> -223513428.4936302 | U42: =7680/(126-A42) -> 202.10526315789474 | V42: =92544/U42 -> 457.9 | W42: =174592/33513982*V42 -> 2.385442493822429 | X42: =LOG(W42,2)*1200*65536 -> 98638776.828009367 | Z42: -8192 | AA42: =(92544+Z42)/92544 * 100 -> 91.147994467496545 | AB42: =AA42*655360 -> 59734749.65421854
A43: 87 | C43: -226804553 | D43: =C43/1200/65536 -> -2.8839690272013345 | E43: =D43*LOG(2,10) -> -0.86816118375347362 | F43: =POWER(2, D43) -> 0.13546865416136733 | H43: 102097300 | I43: =H43/1200/65536 -> 1.2982343037923176 | J43: =I43*LOG(2,10) -> 0.39080746684143297 | K43: =POWER(2, I43) -> 2.459277105926934 | M43: 64968390 | N43: =M43/655360 -> 99.133895874023438 | P43: =255-A43 -> 168 | Q43: =-LOG(92544,2)/(LOG(P43,2)-8) -> 27.14879849343572 | R43: =174592/33513982*Q43 -> 0.14143240354327125 | S43: =LOG(R43,2)*1200*65536 -> -221916592.97247076 | U43: =7680/(126-A43) -> 196.92307692307693 | V43: =92544/U43 -> 469.95 | W43: =174592/33513982*V43 -> 2.4482172962914404 | X43: =LOG(W43,2)*1200*65536 -> 101585907.58119036 | Z43: -8448 | AA43: =(92544+Z43)/92544 * 100 -> 90.871369294605813 | AB43: =AA43*655360 -> 59553460.580912866
A44: 86 | C44: -226804553 | D44: =C44/1200/65536 -> -2.8839690272013345 | E44: =D44*LOG(2,10) -> -0.86816118375347362 | F44: =POWER(2, D44) -> 0.13546865416136733 | H44: 104475964 | I44: =H44/1200/65536 -> 1.3284805806477864 | J44: =I44*LOG(2,10) -> 0.39991250343208629 | K44: =POWER(2, I44) -> 2.5113804170127492 | M44: 64950312 | N44: =M44/655360 -> 99.106311035156253 | P44: =255-A44 -> 169 | Q44: =-LOG(92544,2)/(LOG(P44,2)-8) -> 27.536781135627262 | R44: =174592/33513982*Q44 -> 0.14345360966152679 | S44: =LOG(R44,2)*1200*65536 -> -220306642.65174434 | U44: =7680/(126-A44) -> 192 | V44: =92544/U44 -> 482 | W44: =174592/33513982*V44 -> 2.5109920987604517 | X44: =LOG(W44,2)*1200*65536 -> 104458419.35460861 | Z44: -8704 | AA44: =(92544+Z44)/92544 * 100 -> 90.594744121715081 | AB44: =AA44*655360 -> 59372171.507607192
A45: 85 | C45: -226804553 | D45: =C45/1200/65536 -> -2.8839690272013345 | E45: =D45*LOG(2,10) -> -0.86816118375347362 | F45: =POWER(2, D45) -> 0.13546865416136733 | H45: 107266060 | I45: =H45/1200/65536 -> 1.3639584859212239 | J45: =I45*LOG(2,10) -> 0.41059241710271632 | K45: =POWER(2, I45) -> 2.5739044284932362 | M45: 64932179 | N45: =M45/655360 -> 99.078642272949224 | P45: =255-A45 -> 170 | Q45: =-LOG(92544,2)/(LOG(P45,2)-8) -> 27.933624535091202 | R45: =174592/33513982*Q45 -> 0.14552097613559148 | S45: =LOG(R45,2)*1200*65536 -> -218683222.47231829 | U45: =7680/(126-A45) -> 187.3170731707317 | V45: =92544/U45 -> 494.05 | W45: =174592/33513982*V45 -> 2.5737669012294631 | X45: =LOG(W45,2)*1200*65536 -> 107259997.61234368 | Z45: -8960 | AA45: =(92544+Z45)/92544 * 100 -> 90.318118948824349 | AB45: =AA45*655360 -> 59190882.434301525
A46: 84 | C46: -218396400 | D46: =C46/1200/65536 -> -2.7770538330078125 | E46: =D46*LOG(2,10) -> -0.83597650330898399 | F46: =POWER(2, D46) -> 0.14588931888287221 | H46: 110436753 | I46: =H46/1200/65536 -> 1.4042759323120118 | J46: =I46*LOG(2,10) -> 0.42272917781491798 | K46: =POWER(2, I46) -> 2.6468490722711295 | M46: 64913990 | N46: =M46/655360 -> 99.050888061523438 | P46: =255-A46 -> 171 | Q46: =-LOG(92544,2)/(LOG(P46,2)-8) -> 28.339642889151261 | R46: =174592/33513982*Q46 -> 0.1476361397849619 | S46: =LOG(R46,2)*1200*65536 -> -217045965.75331697 | U46: =7680/(126-A46) -> 182.85714285714286 | V46: =92544/U46 -> 506.1 | W46: =174592/33513982*V46 -> 2.636541703698474 | X46: =LOG(W46,2)*1200*65536 -> 109994061.34583737 | Z46: -9216 | AA46: =(92544+Z46)/92544 * 100 -> 90.041493775933617 | AB46: =AA46*655360 -> 59009593.360995859
A47: 83 | C47: -218396400 | D47: =C47/1200/65536 -> -2.7770538330078125 | E47: =D47*LOG(2,10) -> -0.83597650330898399 | F47: =POWER(2, D47) -> 0.14588931888287221 | H47: 112867303 | I47: =H47/1200/65536 -> 1.4351819737752278 | J47: =I47*LOG(2,10) -> 0.43203282334258075 | K47: =POWER(2, I47) -> 2.7041627330552647 | M47: 64895746 | N47: =M47/655360 -> 99.023049926757807 | P47: =255-A47 -> 172 | Q47: =-LOG(92544,2)/(LOG(P47,2)-8) -> 28.755165334813782 | R47: =174592/33513982*Q47 -> 0.1498008152578171 | S47: =LOG(R47,2)*1200*65536 -> -215394493.62347797 | U47: =7680/(126-A47) -> 178.6046511627907 | V47: =92544/U47 -> 518.15 | W47: =174592/33513982*V47 -> 2.6993165061674853 | X47: =LOG(W47,2)*1200*65536 -> 112663788.15975082 | Z47: -9472 | AA47: =(92544+Z47)/92544 * 100 -> 89.764868603042885 | AB47: =AA47*655360 -> 58828304.287690185
A48: 82 | C48: -218396400 | D48: =C48/1200/65536 -> -2.7770538330078125 | E48: =D48*LOG(2,10) -> -0.83597650330898399 | F48: =POWER(2, D48) -> 0.14588931888287221 | H48: 115460745 | I48: =H48/1200/65536 -> 1.4681592941284181 | J48: =I48*LOG(2,10) -> 0.44195998594551128 | K48: =POWER(2, I48) -> 2.7666867228691836 | M48: 64877444 | N48: =M48/655360 -> 98.995123291015631 | P48: =255-A48 -> 173 | Q48: =-LOG(92544,2)/(LOG(P48,2)-8) -> 29.180536849212508 | R48: =174592/33513982*Q48 -> 0.1520167997219104 | S48: =LOG(R48,2)*1200*65536 -> -213728414.41897032 | U48: =7680/(126-A48) -> 174.54545454545453 | V48: =92544/U48 -> 530.2 | W48: =174592/33513982*V48 -> 2.7620913086364971 | X48: =LOG(W48,2)*1200*65536 -> 115272136.47357951 | Z48: -9728 | AA48: =(92544+Z48)/92544 * 100 -> 89.488243430152153 | AB48: =AA48*655360 -> 58647015.214384511
A49: 81 | C49: -214415003 | D49: =C49/1200/65536 -> -2.7264277521769205 | E49: =D49*LOG(2,10) -> -0.82073653441597627 | F49: =POWER(2, D49) -> 0.15109965251295254 | H49: 118204983 | I49: =H49/1200/65536 -> 1.503054084777832 | J49: =I49*LOG(2,10) -> 0.4524643646233999 | K49: =POWER(2, I49) -> 2.8344210498170463 | M49: 64859087 | N49: =M49/655360 -> 98.967112731933597 | P49: =255-A49 -> 174 | Q49: =-LOG(92544,2)/(LOG(P49,2)-8) -> 29.616119215926169 | R49: =174592/33513982*Q49 -> 0.15428597789862694 | S49: =LOG(R49,2)*1200*65536 -> -212047323.04522178 | U49: =7680/(126-A49) -> 170.66666666666666 | V49: =92544/U49 -> 542.25 | W49: =174592/33513982*V49 -> 2.824866111105508 | X49: =LOG(W49,2)*1200*65536 -> 117821865.22803666 | Z49: -9984 | AA49: =(92544+Z49)/92544 * 100 -> 89.211618257261421 | AB49: =AA49*655360 -> 58465726.141078845
A50: 80 | C50: -214415003 | D50: =C50/1200/65536 -> -2.7264277521769205 | E50: =D50*LOG(2,10) -> -0.82073653441597627 | F50: =POWER(2, D50) -> 0.15109965251295254 | H50: 120884410 | I50: =H50/1200/65536 -> 1.537124760945638 | J50: =I50*LOG(2,10) -> 0.46272066012246343 | K50: =POWER(2, I50) -> 2.9021553765323094 | M50: 64840672 | N50: =M50/655360 -> 98.939013671875003 | P50: =255-A50 -> 175 | Q50: =-LOG(92544,2)/(LOG(P50,2)-8) -> 30.06229206286438 | R50: =174592/33513982*Q50 -> 0.15661032746987863 | S50: =LOG(R50,2)*1200*65536 -> -210350800.30007914 | U50: =7680/(126-A50) -> 166.95652173913044 | V50: =92544/U50 -> 554.3 | W50: =174592/33513982*V50 -> 2.8876409135745189 | X50: =LOG(W50,2)*1200*65536 -> 120315551.42534563 | Z50: -10240 | AA50: =(92544+Z50)/92544 * 100 -> 88.934993084370674 | AB50: =AA50*655360 -> 58284437.067773163
A51: 79 | C51: -214415003 | D51: =C51/1200/65536 -> -2.7264277521769205 | E51: =D51*LOG(2,10) -> -0.82073653441597627 | F51: =POWER(2, D51) -> 0.15109965251295254 | H51: 122903292 | I51: =H51/1200/65536 -> 1.5627961730957032 | J51: =I51*LOG(2,10) -> 0.47044852521068586 | K51: =POWER(2, I51) -> 2.954258713969601 | M51: 64822200 | N51: =M51/655360 -> 98.91082763671875 | P51: =255-A51 -> 176 | Q51: =-LOG(92544,2)/(LOG(P51,2)-8) -> 30.519453977981797 | R51: =174592/33513982*Q51 -> 0.15899192489044714 | S51: =LOG(R51,2)*1200*65536 -> -208638412.15541378 | U51: =7680/(126-A51) -> 163.40425531914894 | V51: =92544/U51 -> 566.35 | W51: =174592/33513982*V51 -> 2.9504157160435307 | X51: =LOG(W51,2)*1200*65536 -> 122755605.78301755 | Z51: -10496 | AA51: =(92544+Z51)/92544 * 100 -> 88.658367911479942 | AB51: =AA51*655360 -> 58103147.994467497
A52: 78 | C52: -214415003 | D52: =C52/1200/65536 -> -2.7264277521769205 | E52: =D52*LOG(2,10) -> -0.82073653441597627 | F52: =POWER(2, D52) -> 0.15109965251295254 | H52: 125083341 | I52: =H52/1200/65536 -> 1.5905169296264647 | J52: =I52*LOG(2,10) -> 0.4787933044289433 | K52: =POWER(2, I52) -> 3.0115723729419157 | M52: 64794383 | N52: =M52/655360 -> 98.868382263183591 | P52: =255-A52 -> 177 | Q52: =-LOG(92544,2)/(LOG(P52,2)-8) -> 30.988023709719457 | R52: =174592/33513982*Q52 -> 0.16143295164171595 | S52: =LOG(R52,2)*1200*65536 -> -206909708.99401021 | U52: =7680/(126-A52) -> 160 | V52: =92544/U52 -> 578.4 | W52: =174592/33513982*V52 -> 3.0131905185125416 | X52: =LOG(W52,2)*1200*65536 -> 125144286.73947681 | Z52: -10880 | AA52: =(92544+Z52)/92544 * 100 -> 88.243430152143844 | AB52: =AA52*655360 -> 57831214.38450899
A53: 77 | C53: -210568596 | D53: =C53/1200/65536 -> -2.6775181579589842 | E53: =D53*LOG(2,10) -> -0.80601327948062373 | F53: =POWER(2, D53) -> 0.15630998467965579 | H53: 127990199 | I53: =H53/1200/65536 -> 1.6274795405069986 | J53: =I53*LOG(2,10) -> 0.48992015902203984 | K53: =POWER(2, I53) -> 3.0897273628247435 | M53: 64775766 | N53: =M53/655360 -> 98.839974975585932 | P53: =255-A53 -> 178 | Q53: =-LOG(92544,2)/(LOG(P53,2)-8) -> 31.468441459775214 | R53: =174592/33513982*Q53 -> 0.1639357009663929 | S53: =LOG(R53,2)*1200*65536 -> -205164224.79831284 | U53: =7680/(126-A53) -> 156.73469387755102 | V53: =92544/U53 -> 590.45 | W53: =174592/33513982*V53 -> 3.075965320981553 | X53: =LOG(W53,2)*1200*65536 -> 127483713.01548393 | Z53: -11136 | AA53: =(92544+Z53)/92544 * 100 -> 87.966804979253112 | AB53: =AA53*655360 -> 57649925.311203316
A54: 76 | C54: -210568596 | D54: =C54/1200/65536 -> -2.6775181579589842 | E54: =D54*LOG(2,10) -> -0.80601327948062373 | F54: =POWER(2, D54) -> 0.15630998467965579 | H54: 130075537 | I54: =H54/1200/65536 -> 1.6539959843953451 | J54: =I54*LOG(2,10) -> 0.49790240401077296 | K54: =POWER(2, I54) -> 3.1470410219122162 | M54: 64757090 | N54: =M54/655360 -> 98.811477661132813 | P54: =255-A54 -> 179 | Q54: =-LOG(92544,2)/(LOG(P54,2)-8) -> 31.961170276599216 | R54: =174592/33513982*Q54 -> 0.1665025851279627 | S54: =LOG(R54,2)*1200*65536 -> -203401476.28728044 | U54: =7680/(126-A54) -> 153.6 | V54: =92544/U54 -> 602.5 | W54: =174592/33513982*V54 -> 3.1387401234505643 | X54: =LOG(W54,2)*1200*65536 -> 129775874.90645441 | Z54: -11392 | AA54: =(92544+Z54)/92544 * 100 -> 87.69017980636238 | AB54: =AA54*655360 -> 57468636.237897649
A55: 75 | C55: -206848323 | D55: =C55/1200/65536 -> -2.6302124404907228 | E55: =D55*LOG(2,10) -> -0.79177283955627153 | F55: =POWER(2, D55) -> 0.1615203178034656 | H55: 132307573 | I55: =H55/1200/65536 -> 1.682377789815267 | J55: =I55*LOG(2,10) -> 0.50644617877326803 | K55: =POWER(2, I55) -> 3.2095650247353018 | M55: 64738355 | N55: =M55/655360 -> 98.782890319824219 | P55: =255-A55 -> 180 | Q55: =-LOG(92544,2)/(LOG(P55,2)-8) -> 32.466697558890509 | R55: =174592/33513982*Q55 -> 0.16913614324319359 | S55: =LOG(R55,2)*1200*65536 -> -201620961.99726877 | U55: =7680/(126-A55) -> 150.58823529411765 | V55: =92544/U55 -> 614.55 | W55: =174592/33513982*V55 -> 3.2015149259195756 | X55: =LOG(W55,2)*1200*65536 -> 132022644.45649551 | Z55: -11648 | AA55: =(92544+Z55)/92544 * 100 -> 87.413554633471648 | AB55: =AA55*655360 -> 57287347.164591983
A56: 74 | C56: -206848323 | D56: =C56/1200/65536 -> -2.6302124404907228 | E56: =D56*LOG(2,10) -> -0.79177283955627153 | F56: =POWER(2, D56) -> 0.1615203178034656 | H56: 134677066 | I56: =H56/1200/65536 -> 1.7125074513753256 | J56: =I56*LOG(2,10) -> 0.51551611066204961 | K56: =POWER(2, I56) -> 3.2772993410511528 | M56: 64710141 | N56: =M56/655360 -> 98.739839172363276 | P56: =255-A56 -> 181 | Q56: =-LOG(92544,2)/(LOG(P56,2)-8) -> 32.985536679362866 | R56: =174592/33513982*Q56 -> 0.17183904974118924 | S56: =LOG(R56,2)*1200*65536 -> -199822161.30247554 | U56: =7680/(126-A56) -> 147.69230769230768 | V56: =92544/U56 -> 626.6 | W56: =174592/33513982*V56 -> 3.264289728388587 | X56: =LOG(W56,2)*1200*65536 -> 134225784.64447632 | Z56: -12032 | AA56: =(92544+Z56)/92544 * 100 -> 86.99861687413555 | AB56: =AA56*655360 -> 57015413.554633476
A57: 73 | C57: -203246174 | D57: =C57/1200/65536 -> -2.5844087473551434 | E57: =D57*LOG(2,10) -> -0.77798455401027378 | F57: =POWER(2, D57) -> 0.16673065104292162 | H57: 136998085 | I57: =H57/1200/65536 -> 1.7420207341512044 | J57: =I57*LOG(2,10) -> 0.52440049404810229 | K57: =POWER(2, I57) -> 3.3450336735274568 | M57: 64691257 | N57: =M57/655360 -> 98.711024475097659 | P57: =255-A57 -> 182 | Q57: =-LOG(92544,2)/(LOG(P57,2)-8) -> 33.518228740156481 | R57: =174592/33513982*Q57 -> 0.17461412350825395 | S57: =LOG(R57,2)*1200*65536 -> -198004533.3700667 | U57: =7680/(126-A57) -> 144.90566037735849 | V57: =92544/U57 -> 638.65 | W57: =174592/33513982*V57 -> 3.3270645308575983 | X57: =LOG(W57,2)*1200*65536 -> 136386957.69506738 | Z57: -12288 | AA57: =(92544+Z57)/92544 * 100 -> 86.721991701244818 | AB57: =AA57*655360 -> 56834124.481327802
A58: 72 | C58: -203246174 | D58: =C58/1200/65536 -> -2.5844087473551434 | E58: =D58*LOG(2,10) -> -0.77798455401027378 | F58: =POWER(2, D58) -> 0.16673065104292162 | H58: 138577575 | I58: =H58/1200/65536 -> 1.7621049880981445 | J58: =I58*LOG(2,10) -> 0.53044645692666403 | K58: =POWER(2, I58) -> 3.3919266875329455 | M58: 64662818 | N58: =M58/655360 -> 98.66763000488281 | P58: =255-A58 -> 183 | Q58: =-LOG(92544,2)/(LOG(P58,2)-8) -> 34.06534447251984 | R58: =174592/33513982*Q58 -> 0.17746433778433682 | S58: =LOG(R58,2)*1200*65536 -> -196167516.04463711 | U58: =7680/(126-A58) -> 142.22222222222223 | V58: =92544/U58 -> 650.7 | W58: =174592/33513982*V58 -> 3.3898393333266092 | X58: =LOG(W58,2)*1200*65536 -> 138507732.61290485 | Z58: -12672 | AA58: =(92544+Z58)/92544 * 100 -> 86.30705394190872 | AB58: =AA58*655360 -> 56562190.871369302
A59: 71 | C59: -199754879 | D59: =C59/1200/65536 -> -2.5400146357218425 | E59: =D59*LOG(2,10) -> -0.76462059477779487 | F59: =POWER(2, D59) -> 0.17194098296732604 | H59: 140991669 | I59: =H59/1200/65536 -> 1.7928017807006835 | J59: =I59*LOG(2,10) -> 0.53968711227070443 | K59: =POWER(2, I59) -> 3.4648713363832879 | M59: 64643783 | N59: =M59/655360 -> 98.638584899902341 | P59: =255-A59 -> 184 | Q59: =-LOG(92544,2)/(LOG(P59,2)-8) -> 34.627486294787438 | R59: =174592/33513982*Q59 -> 0.18039283088412258 | S59: =LOG(R59,2)*1200*65536 -> -194310524.65614572 | U59: =7680/(126-A59) -> 139.63636363636363 | V59: =92544/U59 -> 662.75 | W59: =174592/33513982*V59 -> 3.452614135795621 | X59: =LOG(W59,2)*1200*65536 -> 140589592.02542529 | Z59: -12928 | AA59: =(92544+Z59)/92544 * 100 -> 86.030428769017988 | AB59: =AA59*655360 -> 56380901.798063628
A60: 70 | C60: -199754879 | D60: =C60/1200/65536 -> -2.5400146357218425 | E60: =D60*LOG(2,10) -> -0.76462059477779487 | F60: =POWER(2, D60) -> 0.17194098296732604 | H60: 142685106 | I60: =H60/1200/65536 -> 1.814334945678711 | J60: =I60*LOG(2,10) -> 0.54616924083067186 | K60: =POWER(2, I60) -> 3.5169746731076086 | M60: 64624686 | N60: =M60/655360 -> 98.609445190429682 | P60: =255-A60 -> 185 | Q60: =-LOG(92544,2)/(LOG(P60,2)-8) -> 35.205290544262347 | R60: =174592/33513982*Q60 -> 0.18340291782408463 | S60: =LOG(R60,2)*1200*65536 -> -192432950.74488351 | U60: =7680/(126-A60) -> 137.14285714285714 | V60: =92544/U60 -> 674.8 | W60: =174592/33513982*V60 -> 3.5153889382646324 | X60: =LOG(W60,2)*1200*65536 -> 142633938.40912336 | Z60: -13184 | AA60: =(92544+Z60)/92544 * 100 -> 85.753803596127241 | AB60: =AA60*655360 -> 56199612.724757947
A61: 69 | C61: -196367817 | D61: =C61/1200/65536 -> -2.496945915222168 | E61: =D61*LOG(2,10) -> -0.75165561803252467 | F61: =POWER(2, D61) -> 0.17715131561356542 | H61: 145178792 | I61: =H61/1200/65536 -> 1.8460438028971353 | J61: =I61*LOG(2,10) -> 0.55571455798164393 | K61: =POWER(2, I61) -> 3.5951296595912359 | M61: 64595925 | N61: =M61/655360 -> 98.565559387207031 | P61: =255-A61 -> 186 | Q61: =-LOG(92544,2)/(LOG(P61,2)-8) -> 35.799429900391559 | R61: =174592/33513982*Q61 -> 0.18649810294608271 | S61: =LOG(R61,2)*1200*65536 -> -190534160.69640851 | U61: =7680/(126-A61) -> 134.73684210526315 | V61: =92544/U61 -> 686.85 | W61: =174592/33513982*V61 -> 3.5781637407336437 | X61: =LOG(W61,2)*1200*65536 -> 144642099.76472342 | Z61: -13568 | AA61: =(92544+Z61)/92544 * 100 -> 85.338865836791143 | AB61: =AA61*655360 -> 55927679.11479944
A62: 68 | C62: -196367817 | D62: =C62/1200/65536 -> -2.496945915222168 | E62: =D62*LOG(2,10) -> -0.75165561803252467 | F62: =POWER(2, D62) -> 0.17715131561356542 | H62: 146973279 | I62: =H62/1200/65536 -> 1.8688618850708008 | J62: =I62*LOG(2,10) -> 0.56258348515944279 | K62: =POWER(2, I62) -> 3.6524433203970994 | M62: 64567023 | N62: =M62/655360 -> 98.521458435058591 | P62: =255-A62 -> 187 | Q62: =-LOG(92544,2)/(LOG(P62,2)-8) -> 36.410616018643076 | R62: =174592/33513982*Q62 -> 0.18968209363861721 | S62: =LOG(R62,2)*1200*65536 -> -188613494.27865538 | U62: =7680/(126-A62) -> 132.41379310344828 | V62: =92544/U62 -> 698.9 | W62: =174592/33513982*V62 -> 3.6409385432026546 | X62: =LOG(W62,2)*1200*65536 -> 146615334.79877946 | Z62: -13952 | AA62: =(92544+Z62)/92544 * 100 -> 84.923928077455045 | AB62: =AA62*655360 -> 55655745.50484094
A63: 67 | C63: -193078944 | D63: =C63/1200/65536 -> -2.4551257324218749 | E63: =D63*LOG(2,10) -> -0.73906648858548551 | F63: =POWER(2, D63) -> 0.18236164932390989 | H63: 148580362 | I63: =H63/1200/65536 -> 1.8892970021565756 | J63: =I63*LOG(2,10) -> 0.56873506836716647 | K63: =POWER(2, I63) -> 3.7045466525833715 | M63: 64547677 | N63: =M63/655360 -> 98.491938781738284 | P63: =255-A63 -> 188 | Q63: =-LOG(92544,2)/(LOG(P63,2)-8) -> 37.039602396774633 | R63: =174592/33513982*Q63 -> 0.19295881526873401 | S63: =LOG(R63,2)*1200*65536 -> -186670263.07263806 | U63: =7680/(126-A63) -> 130.16949152542372 | V63: =92544/U63 -> 710.95 | W63: =174592/33513982*V63 -> 3.7037133456716664 | X63: =LOG(W63,2)*1200*65536 -> 148554837.66233596 | Z63: -14208 | AA63: =(92544+Z63)/92544 * 100 -> 84.647302904564313 | AB63: =AA63*655360 -> 55474456.431535266
A64: 66 | C64: -193078944 | D64: =C64/1200/65536 -> -2.4551257324218749 | E64: =D64*LOG(2,10) -> -0.73906648858548551 | F64: =POWER(2, D64) -> 0.18236164932390989 | H64: 150479287 | I64: =H64/1200/65536 -> 1.9134430821736654 | J64: =I64*LOG(2,10) -> 0.57600376273001319 | K64: =POWER(2, I64) -> 3.7670706276203632 | M64: 64518539 | N64: =M64/655360 -> 98.447477722167974 | P64: =255-A64 -> 189 | Q64: =-LOG(92544,2)/(LOG(P64,2)-8) -> 37.687187497773266 | R64: =174592/33513982*Q64 -> 0.19633242745106294 | S64: =LOG(R64,2)*1200*65536 -> -184703748.78727728 | U64: =7680/(126-A64) -> 128 | V64: =92544/U64 -> 723 | W64: =174592/33513982*V64 -> 3.7664881481406773 | X64: =LOG(W64,2)*1200*65536 -> 150461742.29132262 | Z64: -14592 | AA64: =(92544+Z64)/92544 * 100 -> 84.232365145228215 | AB64: =AA64*655360 -> 55202522.821576759
A65: 65 | C65: -189882728 | D65: =C65/1200/65536 -> -2.4144837443033853 | E65: =D65*LOG(2,10) -> -0.726832031078401 | F65: =POWER(2, D65) -> 0.18757198263253885 | H65: 153116164 | I65: =H65/1200/65536 -> 1.9469727071126302 | J65: =I65*LOG(2,10) -> 0.58609718558000468 | K65: =POWER(2, I65) -> 3.8556462892026584 | M65: 64499034 | N65: =M65/655360 -> 98.417715454101568 | P65: =255-A65 -> 190 | Q65: =-LOG(92544,2)/(LOG(P65,2)-8) -> 38.354218156689029 | R65: =174592/33513982*Q65 -> 0.19980734179581081 | S65: =LOG(R65,2)*1200*65536 -> -182713201.44788268 | U65: =7680/(126-A65) -> 125.90163934426229 | V65: =92544/U65 -> 735.05 | W65: =174592/33513982*V65 -> 3.8292629506096891 | X65: =LOG(W65,2)*1200*65536 -> 152337126.38818836 | Z65: -14848 | AA65: =(92544+Z65)/92544 * 100 -> 83.955739972337483 | AB65: =AA65*655360 -> 55021233.748271093
A66: 64 | C66: -189882728 | D66: =C66/1200/65536 -> -2.4144837443033853 | E66: =D66*LOG(2,10) -> -0.726832031078401 | F66: =POWER(2, D66) -> 0.18757198263253885 | H66: 154941268 | I66: =H66/1200/65536 -> 1.9701801045735676 | J66: =I66*LOG(2,10) -> 0.59308330833704292 | K66: =POWER(2, I66) -> 3.9181703001905399 | M66: 64469656 | N66: =M66/655360 -> 98.372888183593744 | P66: =255-A66 -> 191 | Q66: =-LOG(92544,2)/(LOG(P66,2)-8) -> 39.041593301936842 | R66: =174592/33513982*Q66 -> 0.2033882412949842 | S66: =LOG(R66,2)*1200*65536 -> -180697837.44670317 | U66: =7680/(126-A66) -> 123.87096774193549 | V66: =92544/U66 -> 747.1 | W66: =174592/33513982*V66 -> 3.8920377530787 | X66: =LOG(W66,2)*1200*65536 -> 154182015.07977989 | Z66: -15232 | AA66: =(92544+Z66)/92544 * 100 -> 83.540802213001385 | AB66: =AA66*655360 -> 54749300.138312586
A67: 63 | C67: -183748361 | D67: =C67/1200/65536 -> -2.3364812342325845 | E67: =D67*LOG(2,10) -> -0.70335093581000818 | F67: =POWER(2, D67) -> 0.19799264806941233 | H67: 156737477 | I67: =H67/1200/65536 -> 1.9930200831095377 | J67: =I67*LOG(2,10) -> 0.59995882697669145 | K67: =POWER(2, I67) -> 3.9806943003516801 | M67: 64440131 | N67: =M67/655360 -> 98.327836608886713 | P67: =255-A67 -> 192 | Q67: =-LOG(92544,2)/(LOG(P67,2)-8) -> 39.75026802546099 | R67: =174592/33513982*Q67 -> 0.20708010152602233 | S67: =LOG(R67,2)*1200*65536 -> -178656837.44270179 | U67: =7680/(126-A67) -> 121.9047619047619 | V67: =92544/U67 -> 759.15 | W67: =174592/33513982*V67 -> 3.9548125555477118 | X67: =LOG(W67,2)*1200*65536 -> 155997384.28255141 | Z67: -15616 | AA67: =(92544+Z67)/92544 * 100 -> 83.125864453665287 | AB67: =AA67*655360 -> 54477366.528354079
A68: 62 | C68: -183748361 | D68: =C68/1200/65536 -> -2.3364812342325845 | E68: =D68*LOG(2,10) -> -0.70335093581000818 | F68: =POWER(2, D68) -> 0.19799264806941233 | H68: 157772281 | I68: =H68/1200/65536 -> 2.006178296407064 | J68: =I68*LOG(2,10) -> 0.60391984386859154 | K68: =POWER(2, I68) -> 4.0171666064329212 | M68: 64410458 | N68: =M68/655360 -> 98.28255920410156 | P68: =255-A68 -> 193 | Q68: =-LOG(92544,2)/(LOG(P68,2)-8) -> 40.481258040525553 | R68: =174592/33513982*Q68 -> 0.2108882138747773 | S68: =LOG(R68,2)*1200*65536 -> -176589344.09629592 | U68: =7680/(126-A68) -> 120 | V68: =92544/U68 -> 771.2 | W68: =174592/33513982*V68 -> 4.0175873580167227 | X68: =LOG(W68,2)*1200*65536 -> 157784163.80276281 | Z68: -16000 | AA68: =(92544+Z68)/92544 * 100 -> 82.710926694329174 | AB68: =AA68*655360 -> 54205432.918395564
A69: 61 | C69: -180801230 | D69: =C69/1200/65536 -> -2.2990065256754559 | E69: =D69*LOG(2,10) -> -0.69206992445554683 | F69: =POWER(2, D69) -> 0.20320298135539583 | H69: 159669375 | I69: =H69/1200/65536 -> 2.0303010940551758 | J69: =I69*LOG(2,10) -> 0.61118152954000571 | K69: =POWER(2, I69) -> 4.0849009428928538 | M69: 64390594 | N69: =M69/655360 -> 98.252249145507818 | P69: =255-A69 -> 194 | Q69: =-LOG(92544,2)/(LOG(P69,2)-8) -> 41.235644570894856 | R69: =174592/33513982*Q69 -> 0.21481821100583257 | S69: =LOG(R69,2)*1200*65536 -> -174494459.62320694 | U69: =7680/(126-A69) -> 118.15384615384616 | V69: =92544/U69 -> 783.25 | W69: =174592/33513982*V69 -> 4.0803621604857341 | X69: =LOG(W69,2)*1200*65536 -> 159543240.19632214 | Z69: -16256 | AA69: =(92544+Z69)/92544 * 100 -> 82.434301521438442 | AB69: =AA69*655360 -> 54024143.845089898
A70: 60 | C70: -180801230 | D70: =C70/1200/65536 -> -2.2990065256754559 | E70: =D70*LOG(2,10) -> -0.69206992445554683 | F70: =POWER(2, D70) -> 0.20320298135539583 | H70: 161535269 | I70: =H70/1200/65536 -> 2.0540271631876625 | J70: =I70*LOG(2,10) -> 0.61832378802808152 | K70: =POWER(2, I70) -> 4.1526352676140474 | M70: 64360671 | N70: =M70/655360 -> 98.206590270996088 | P70: =255-A70 -> 195 | Q70: =-LOG(92544,2)/(LOG(P70,2)-8) -> 42.014579720908586 | R70: =174592/33513982*Q70 -> 0.21887609483805509 | S70: =LOG(R70,2)*1200*65536 -> -172371243.14975598 | U70: =7680/(126-A70) -> 116.36363636363636 | V70: =92544/U70 -> 795.3 | W70: =174592/33513982*V70 -> 4.1431369629547454 | X70: =LOG(W70,2)*1200*65536 -> 161275459.41029352 | Z70: -16640 | AA70: =(92544+Z70)/92544 * 100 -> 82.019363762102344 | AB70: =AA70*655360 -> 53752210.23513139
A71: 59 | C71: -177928719 | D71: =C71/1200/65536 -> -2.2624806594848632 | E71: =D71*LOG(2,10) -> -0.68107454311456961 | F71: =POWER(2, D71) -> 0.20841331278995656 | H71: 163510958 | I71: =H71/1200/65536 -> 2.0791493479410805 | J71: =I71*LOG(2,10) -> 0.62588631919547266 | K71: =POWER(2, I71) -> 4.2255799112397474 | M71: 64330597 | N71: =M71/655360 -> 98.160700988769534 | P71: =255-A71 -> 196 | Q71: =-LOG(92544,2)/(LOG(P71,2)-8) -> 42.819292382554977 | R71: =174592/33513982*Q71 -> 0.22306826731765381 | S71: =LOG(R71,2)*1200*65536 -> -170218707.84990555 | U71: =7680/(126-A71) -> 114.6268656716418 | V71: =92544/U71 -> 807.35 | W71: =174592/33513982*V71 -> 4.2059117654237568 | X71: =LOG(W71,2)*1200*65536 -> 162981629.22577149 | Z71: -17024 | AA71: =(92544+Z71)/92544 * 100 -> 81.604426002766246 | AB71: =AA71*655360 -> 53480276.625172883
A72: 58 | C72: -177928719 | D72: =C72/1200/65536 -> -2.2624806594848632 | E72: =D72*LOG(2,10) -> -0.68107454311456961 | F72: =POWER(2, D72) -> 0.20841331278995656 | H72: 165590274 | I72: =H72/1200/65536 -> 2.1055892181396483 | J72: =I72*LOG(2,10) -> 0.63384551320670379 | K72: =POWER(2, I72) -> 4.3037349123714499 | M72: 64300370 | N72: =M72/655360 -> 98.114578247070313 | P72: =255-A72 -> 197 | Q72: =-LOG(92544,2)/(LOG(P72,2)-8) -> 43.651094743256479 | R72: =174592/33513982*Q72 -> 0.22740156432066577 | S72: =LOG(R72,2)*1200*65536 -> -168035817.84201673 | U72: =7680/(126-A72) -> 112.94117647058823 | V72: =92544/U72 -> 819.4 | W72: =174592/33513982*V72 -> 4.2686865678927672 | X72: =LOG(W72,2)*1200*65536 -> 164662521.51978147 | Z72: -17408 | AA72: =(92544+Z72)/92544 * 100 -> 81.189488243430148 | AB72: =AA72*655360 -> 53208343.015214384
A73: 57 | C73: -175127140 | D73: =C73/1200/65536 -> -2.2268567403157551 | E73: =D73*LOG(2,10) -> -0.67035067488155897 | F73: =POWER(2, D73) -> 0.21362364700727221 | H73: 166547733 | I73: =H73/1200/65536 -> 2.1177639389038085 | J73: =I73*LOG(2,10) -> 0.63751046934554911 | K73: =POWER(2, I73) -> 4.3402072626487715 | M73: 64269988 | N73: =M73/655360 -> 98.068218994140622 | P73: =255-A73 -> 198 | Q73: =-LOG(92544,2)/(LOG(P73,2)-8) -> 44.511389466863392 | R73: =174592/33513982*Q73 -> 0.23188329306253769 | S73: =LOG(R73,2)*1200*65536 -> -165821484.82067627 | U73: =7680/(126-A73) -> 111.30434782608695 | V73: =92544/U73 -> 831.45 | W73: =174592/33513982*V73 -> 4.3314613703617795 | X73: =LOG(W73,2)*1200*65536 -> 166318874.36205971 | Z73: -17792 | AA73: =(92544+Z73)/92544 * 100 -> 80.77455048409405 | AB73: =AA73*655360 -> 52936409.405255876
A74: 56 | C74: -172393077 | D74: =C74/1200/65536 -> -2.1920913314819335 | E74: =D74*LOG(2,10) -> -0.65988524401105708 | F74: =POWER(2, D74) -> 0.21883397844637203 | H74: 168706336 | I74: =H74/1200/65536 -> 2.1452119954427085 | J74: =I74*LOG(2,10) -> 0.64577315768643884 | K74: =POWER(2, I74) -> 4.423572583166969 | M74: 64239449 | N74: =M74/655360 -> 98.021620178222662 | P74: =255-A74 -> 199 | Q74: =-LOG(92544,2)/(LOG(P74,2)-8) -> 45.401677630536454 | R74: =174592/33513982*Q74 -> 0.23652127344553148 | S74: =LOG(R74,2)*1200*65536 -> -163574564.3959178 | U74: =7680/(126-A74) -> 109.71428571428571 | V74: =92544/U74 -> 843.5 | W74: =174592/33513982*V74 -> 4.3942361728307899 | X74: =LOG(W74,2)*1200*65536 -> 167951393.96096918 | Z74: -18176 | AA74: =(92544+Z74)/92544 * 100 -> 80.359612724757952 | AB74: =AA74*655360 -> 52664475.795297369
A75: 55 | C75: -172393077 | D75: =C75/1200/65536 -> -2.1920913314819335 | E75: =D75*LOG(2,10) -> -0.65988524401105708 | F75: =POWER(2, D75) -> 0.21883397844637203 | H75: 169637962 | I75: =H75/1200/65536 -> 2.1570582326253254 | J75: =I75*LOG(2,10) -> 0.64933923041415653 | K75: =POWER(2, I75) -> 4.4600448955488341 | M75: 64208753 | N75: =M75/655360 -> 97.974781799316403 | P75: =255-A75 -> 200 | Q75: =-LOG(92544,2)/(LOG(P75,2)-8) -> 46.323567511999002 | R75: =174592/33513982*Q75 -> 0.24132388383615319 | S75: =LOG(R75,2)*1200*65536 -> -161293852.10876369 | U75: =7680/(126-A75) -> 108.16901408450704 | V75: =92544/U75 -> 855.55 | W75: =174592/33513982*V75 -> 4.4570109752998022 | X75: =LOG(W75,2)*1200*65536 -> 169560756.47139341 | Z75: -18560 | AA75: =(92544+Z75)/92544 * 100 -> 79.944674965421854 | AB75: =AA75*655360 -> 52392542.18533887
A76: 54 | C76: -169723350 | D76: =C76/1200/65536 -> -2.1581439971923828 | E76: =D76*LOG(2,10) -> -0.64966607811706989 | F76: =POWER(2, D76) -> 0.22404431163398639 | H76: 171869137 | I76: =H76/1200/65536 -> 2.1854290898640949 | J76: =I76*LOG(2,10) -> 0.65787970944572671 | K76: =POWER(2, I76) -> 4.5486205535542137 | M76: 64167575 | N76: =M76/655360 -> 97.911949157714844 | P76: =255-A76 -> 201 | Q76: =-LOG(92544,2)/(LOG(P76,2)-8) -> 47.278784335391819 | R76: =174592/33513982*Q76 -> 0.24630011183644868 | S76: =LOG(R76,2)*1200*65536 -> -158978079.0880695 | U76: =7680/(126-A76) -> 106.66666666666667 | V76: =92544/U76 -> 867.6 | W76: =174592/33513982*V76 -> 4.5197857777688126 | X76: =LOG(W76,2)*1200*65536 -> 171147609.67619085 | Z76: -19072 | AA76: =(92544+Z76)/92544 * 100 -> 79.391424619640389 | AB76: =AA76*655360 -> 52029964.038727522
A77: 53 | C77: -167115002 | D77: =C77/1200/65536 -> -2.1249771372477215 | E77: =D77*LOG(2,10) -> -0.63968185841174063 | F77: =POWER(2, D77) -> 0.22925464382855851 | H77: 172904110 | I77: =H77/1200/65536 -> 2.1985894521077474 | J77: =I77*LOG(2,10) -> 0.66184137323486991 | K77: =POWER(2, I77) -> 4.5903032064339069 | M77: 64136503 | N77: =M77/655360 -> 97.864537048339841 | P77: =255-A77 -> 202 | Q77: =-LOG(92544,2)/(LOG(P77,2)-8) -> 48.269181099991407 | R77: =174592/33513982*Q77 -> 0.25145961069650569 | S77: =LOG(R77,2)*1200*65536 -> -156625907.30917132 | U77: =7680/(126-A77) -> 105.20547945205479 | V77: =92544/U77 -> 879.65 | W77: =174592/33513982*V77 -> 4.5825605802378249 | X77: =LOG(W77,2)*1200*65536 -> 172712574.5516758 | Z77: -19456 | AA77: =(92544+Z77)/92544 * 100 -> 78.976486860304291 | AB77: =AA77*655360 -> 51758030.428769022
A78: 52 | C78: -164565273 | D78: =C78/1200/65536 -> -2.0925556564331056 | E78: =D78*LOG(2,10) -> -0.62992202018269694 | F78: =POWER(2, D78) -> 0.23446497715026615 | H78: 175072573 | I78: =H78/1200/65536 -> 2.2261628850301105 | J78: =I78*LOG(2,10) -> 0.67014180362792997 | K78: =POWER(2, I78) -> 4.6788788872514688 | M78: 64105267 | N78: =M78/655360 -> 97.816874694824222 | P78: =255-A78 -> 203 | Q78: =-LOG(92544,2)/(LOG(P78,2)-8) -> 49.29675063481406 | R78: =174592/33513982*Q78 -> 0.25681276211324144 | S78: =LOG(R78,2)*1200*65536 -> -154235924.4096545 | U78: =7680/(126-A78) -> 103.78378378378379 | V78: =92544/U78 -> 891.7 | W78: =174592/33513982*V78 -> 4.6453353827068353 | X78: =LOG(W78,2)*1200*65536 -> 174256246.72659341 | Z78: -19840 | AA78: =(92544+Z78)/92544 * 100 -> 78.561549100968193 | AB78: =AA78*655360 -> 51486096.818810515
A79: 51 | C79: -162071587 | D79: =C79/1200/65536 -> -2.0608467992146808 | E79: =D79*LOG(2,10) -> -0.62037670303172476 | F79: =POWER(2, D79) -> 0.23967530955902117 | H79: 176204021 | I79: =H79/1200/65536 -> 2.2405499903361004 | J79: =I79*LOG(2,10) -> 0.67447275387580929 | K79: =POWER(2, I79) -> 4.7257718812038609 | M79: 64073866 | N79: =M79/655360 -> 97.768960571289057 | P79: =255-A79 -> 204 | Q79: =-LOG(92544,2)/(LOG(P79,2)-8) -> 50.363639044127495 | R79: =174592/33513982*Q79 -> 0.26237074627516083 | S79: =LOG(R79,2)*1200*65536 -> -151806638.01161405 | U79: =7680/(126-A79) -> 102.4 | V79: =92544/U79 -> 903.75 | W79: =174592/33513982*V79 -> 4.7081101851758467 | X79: =LOG(W79,2)*1200*65536 -> 175779197.84316847 | Z79: -20224 | AA79: =(92544+Z79)/92544 * 100 -> 78.146611341632095 | AB79: =AA79*655360 -> 51214163.208852008
A80: 50 | C80: -159631532 | D80: =C80/1200/65536 -> -2.0298198954264324 | E80: =D80*LOG(2,10) -> -0.61103667431888165 | F80: =POWER(2, D80) -> 0.24488564376190877 | H80: 177324297 | I80: =H80/1200/65536 -> 2.2547950363159179 | J80: =I80*LOG(2,10) -> 0.67876094000534692 | K80: =POWER(2, I80) -> 4.7726648714621058 | M80: 64031738 | N80: =M80/655360 -> 97.70467834472656 | P80: =255-A80 -> 205 | Q80: =-LOG(92544,2)/(LOG(P80,2)-8) -> 51.472160734779258 | R80: =174592/33513982*Q80 -> 0.2681456201476321 | S80: =LOG(R80,2)*1200*65536 -> -149336469.49288902 | U80: =7680/(126-A80) -> 101.05263157894737 | V80: =92544/U80 -> 915.8 | W80: =174592/33513982*V80 -> 4.770884987644858 | X80: =LOG(W80,2)*1200*65536 -> 177281976.82800937 | Z80: -20736 | AA80: =(92544+Z80)/92544 * 100 -> 77.593360995850631 | AB80: =AA80*655360 -> 50851585.062240668
A81: 49 | C81: -157242851 | D81: =C81/1200/65536 -> -1.9994462458292643 | E81: =D81*LOG(2,10) -> -0.60189329471234687 | F81: =POWER(2, D81) -> 0.25009597670388378 | H81: 179532201 | I81: =H81/1200/65536 -> 2.2828699874877931 | J81: =I81*LOG(2,10) -> 0.68721234243488305 | K81: =POWER(2, I81) -> 4.8664508608989978 | M81: 63999944 | N81: =M81/655360 -> 97.656164550781256 | P81: =255-A81 -> 206 | Q81: =-LOG(92544,2)/(LOG(P81,2)-8) -> 52.624815246796153 | R81: =174592/33513982*Q81 -> 0.27415040515235206 | S81: =LOG(R81,2)*1200*65536 -> -146823747.14177981 | U81: =A81*2+1 -> 99 | V81: =92544/U81 -> 934.78787878787875 | W81: =174592/33513982*V81 -> 4.869802858202088 | X81: =LOG(W81,2)*1200*65536 -> 179610323.74707788 | Z81: -21120 | AA81: =(92544+Z81)/92544 * 100 -> 77.178423236514533 | AB81: =AA81*655360 -> 50579651.452282161
A82: 48 | C82: -154903425 | D82: =C82/1200/65536 -> -1.9696989059448242 | E82: =D82*LOG(2,10) -> -0.59293845311591886 | F82: =POWER(2, D82) -> 0.25530630893080336 | H82: 181936065 | I82: =H82/1200/65536 -> 2.3134366989135744 | J82: =I82*LOG(2,10) -> 0.69641383944284818 | K82: =POWER(2, I82) -> 4.9706575006699767 | M82: 63957285 | N82: =M82/655360 -> 97.591072082519531 | P82: =255-A82 -> 207 | Q82: =-LOG(92544,2)/(LOG(P82,2)-8) -> 53.824306144867542 | R82: =174592/33513982*Q82 -> 0.28039918558304155 | S82: =LOG(R82,2)*1200*65536 -> -144266698.6204887 | U82: =A82*2+1 -> 97 | V82: =92544/U82 -> 954.06185567010311 | W82: =174592/33513982*V82 -> 4.9702111645567699 | X82: =LOG(W82,2)*1200*65536 -> 181925876.66063192 | Z82: -21632 | AA82: =(92544+Z82)/92544 * 100 -> 76.625172890733069 | AB82: =AA82*655360 -> 50217073.305670828
A83: 47 | C83: -152611263 | D83: =C83/1200/65536 -> -1.9405525588989259 | E83: =D83*LOG(2,10) -> -0.58416452839107114 | F83: =POWER(2, D83) -> 0.26051664201647373 | H83: 184290054 | I83: =H83/1200/65536 -> 2.3433692169189455 | J83: =I83*LOG(2,10) -> 0.70542442520821702 | K83: =POWER(2, I83) -> 5.0748641988286751 | M83: 63914317 | N83: =M83/655360 -> 97.525508117675784 | P83: =255-A83 -> 208 | Q83: =-LOG(92544,2)/(LOG(P83,2)-8) -> 55.073562271254609 | R83: =174592/33513982*Q83 -> 0.28690721932305402 | S83: =LOG(R83,2)*1200*65536 -> -141663442.65174413 | U83: =A83*2+1 -> 95 | V83: =92544/U83 -> 974.14736842105265 | W83: =174592/33513982*V83 -> 5.074847189073755 | X83: =LOG(W83,2)*1200*65536 -> 184289673.71423027 | Z83: -22144 | AA83: =(92544+Z83)/92544 * 100 -> 76.07192254495159 | AB83: =AA83*655360 -> 49854495.159059472
A84: 46 | C84: -150364494 | D84: =C84/1200/65536 -> -1.911983413696289 | E84: =D84*LOG(2,10) -> -0.57556435873459777 | F84: =POWER(2, D84) -> 0.26572697356856834 | H84: 186710279 | I84: =H84/1200/65536 -> 2.3741439692179362 | J84: =I84*LOG(2,10) -> 0.71468854875934229 | K84: =POWER(2, I84) -> 5.1842811849698309 | M84: 63881885 | N84: =M84/655360 -> 97.476020812988281 | P84: =255-A84 -> 209 | Q84: =-LOG(92544,2)/(LOG(P84,2)-8) -> 56.375761711829433 | R84: =174592/33513982*Q84 -> 0.29369106269710726 | S84: =LOG(R84,2)*1200*65536 -> -139011979.83044735 | U84: =A84*2+1 -> 93 | V84: =92544/U84 -> 995.09677419354841 | W84: =174592/33513982*V84 -> 5.1839836877635133 | X84: =LOG(W84,2)*1200*65536 -> 186703768.07759151 | Z84: -22528 | AA84: =(92544+Z84)/92544 * 100 -> 75.656984785615492 | AB84: =AA84*655360 -> 49582561.549100965
A85: 45 | C85: -148161353 | D85: =C85/1200/65536 -> -1.8839690272013347 | E85: =D85*LOG(2,10) -> -0.56713118808949259 | F85: =POWER(2, D85) -> 0.2709373083227346 | H85: 189079953 | I85: =H85/1200/65536 -> 2.4042759323120118 | J85: =I85*LOG(2,10) -> 0.72375917347889906 | K85: =POWER(2, I85) -> 5.2936981445422591 | M85: 63838365 | N85: =M85/655360 -> 97.409614562988281 | P85: =255-A85 -> 210 | Q85: =-LOG(92544,2)/(LOG(P85,2)-8) -> 57.734358888113292 | R85: =174592/33513982*Q85 -> 0.30076871160799318 | S85: =LOG(R85,2)*1200*65536 -> -136310182.4474017 | U85: =A85*2+1 -> 91 | V85: =92544/U85 -> 1016.967032967033 | W85: =174592/33513982*V85 -> 5.2979173951868868 | X85: =LOG(W85,2)*1200*65536 -> 189170346.84324849 | Z85: -23040 | AA85: =(92544+Z85)/92544 * 100 -> 75.103734439834028 | AB85: =AA85*655360 -> 49219983.402489632
A86: 44 | C86: -146000180 | D86: =C86/1200/65536 -> -1.856488291422526 | E86: =D86*LOG(2,10) -> -0.55885866231715475 | F86: =POWER(2, D86) -> 0.27614764105196055 | H86: 191619755 | I86: =H86/1200/65536 -> 2.4365711847941083 | J86: =I86*LOG(2,10) -> 0.73348101319355186 | K86: =POWER(2, I86) -> 5.4135358007027019 | M86: 63794523 | N86: =M86/655360 -> 97.342716979980466 | P86: =255-A86 -> 211 | Q86: =-LOG(92544,2)/(LOG(P86,2)-8) -> 59.153115261576751 | R86: =174592/33513982*Q86 -> 0.30815976149146368 | S86: =LOG(R86,2)*1200*65536 -> -133555783.19481494 | U86: =A86*2+1 -> 89 | V86: =92544/U86 -> 1039.8202247191011 | W86: =174592/33513982*V86 -> 5.4169717186742323 | X86: =LOG(W86,2)*1200*65536 -> 191691742.93314603 | Z86: -23552 | AA86: =(92544+Z86)/92544 * 100 -> 74.550484094052564 | AB86: =AA86*655360 -> 48857405.255878285
A87: 43 | C87: -143879405 | D87: =C87/1200/65536 -> -1.8295212427775065 | E87: =D87*LOG(2,10) -> -0.5507407717804742 | F87: =POWER(2, D87) -> 0.28135797410574731 | H87: 194210730 | I87: =H87/1200/65536 -> 2.4695171356201171 | J87: =I87*LOG(2,10) -> 0.74339873262785094 | K87: =POWER(2, I87) -> 5.5385838198762425 | M87: 63750355 | N87: =M87/655360 -> 97.275321960449219 | P87: =255-A87 -> 212 | Q87: =-LOG(92544,2)/(LOG(P87,2)-8) -> 60.636134224883506 | R87: =174592/33513982*Q87 -> 0.31588558908311343 | S87: =LOG(R87,2)*1200*65536 -> -130746362.60274467 | U87: =A87*2+1 -> 87 | V87: =92544/U87 -> 1063.7241379310344 | W87: =174592/33513982*V87 -> 5.5414998041609964 | X87: =LOG(W87,2)*1200*65536 -> 194270448.35859194 | Z87: -24064 | AA87: =(92544+Z87)/92544 * 100 -> 73.9972337482711 | AB87: =AA87*655360 -> 48494827.109266952
A88: 42 | C88: -139753200 | D88: =C88/1200/65536 -> -1.7770538330078125 | E88: =D88*LOG(2,10) -> -0.53494650764500284 | F88: =POWER(2, D88) -> 0.29177863776574442 | H88: 196848183 | I88: =H88/1200/65536 -> 2.503054084777832 | J88: =I88*LOG(2,10) -> 0.75349436028738104 | K88: =POWER(2, I88) -> 5.6688420996340918 | M88: 63705855 | N88: =M88/655360 -> 97.207420349121094 | P88: =255-A88 -> 213 | Q88: =-LOG(92544,2)/(LOG(P88,2)-8) -> 62.187900861673093 | R88: =174592/33513982*Q88 -> 0.32396955954804857 | S88: =LOG(R88,2)*1200*65536 -> -127879335.03138755 | U88: =A88*2+1 -> 85 | V88: =92544/U88 -> 1088.7529411764706 | W88: =174592/33513982*V88 -> 5.6718880348471377 | X88: =LOG(W88,2)*1200*65536 -> 196909129.02245814 | Z88: -24576 | AA88: =(92544+Z88)/92544 * 100 -> 73.443983402489636 | AB88: =AA88*655360 -> 48132248.962655604
A89: 41 | C89: -137745038 | D89: =C89/1200/65536 -> -1.7515187327067057 | E89: =D89*LOG(2,10) -> -0.52725967651208139 | F89: =POWER(2, D89) -> 0.29698897226977633 | H89: 199527610 | I89: =H89/1200/65536 -> 2.537124760945638 | J89: =I89*LOG(2,10) -> 0.76375065578644463 | K89: =POWER(2, I89) -> 5.8043107530646187 | M89: 63661019 | N89: =M89/655360 -> 97.139006042480474 | P89: =255-A89 -> 214 | Q89: =-LOG(92544,2)/(LOG(P89,2)-8) -> 63.813327386302817 | R89: =174592/33513982*Q89 -> 0.33243726320045708 | S89: =LOG(R89,2)*1200*65536 -> -124951933.01526754 | U89: =A89*2+1 -> 83 | V89: =92544/U89 -> 1114.9879518072289 | W89: =174592/33513982*V89 -> 5.8085600356868277 | X89: =LOG(W89,2)*1200*65536 -> 199610641.28402016 | Z89: -25088 | AA89: =(92544+Z89)/92544 * 100 -> 72.890733056708157 | AB89: =AA89*655360 -> 47769670.816044256
A90: 40 | C90: -135771803 | D90: =C90/1200/65536 -> -1.7264277521769207 | E90: =D90*LOG(2,10) -> -0.51970653875199513 | F90: =POWER(2, D90) -> 0.30219930502590509 | H90: 202344092 | I90: =H90/1200/65536 -> 2.5729381815592447 | J90: =I90*LOG(2,10) -> 0.77453156963847092 | K90: =POWER(2, I90) -> 5.9502000824984869 | M90: 63604493 | N90: =M90/655360 -> 97.052754211425778 | P90: =255-A90 -> 215 | Q90: =-LOG(92544,2)/(LOG(P90,2)-8) -> 65.517805233304188 | R90: =174592/33513982*Q90 -> 0.34131678686504768 | S90: =LOG(R90,2)*1200*65536 -> -121961189.72094789 | U90: =A90*2+1 -> 81 | V90: =92544/U90 -> 1142.5185185185185 | W90: =174592/33513982*V90 -> 5.9519812711358853 | X90: =LOG(W90,2)*1200*65536 -> 202378050.5444665 | Z90: -25728 | AA90: =(92544+Z90)/92544 * 100 -> 72.199170124481327 | AB90: =AA90*655360 -> 47316448.132780083
A91: 39 | C91: -131925396 | D91: =C91/1200/65536 -> -1.6775181579589844 | E91: =D91*LOG(2,10) -> -0.5049832838166427 | F91: =POWER(2, D91) -> 0.31261996935931158 | H91: 205189279 | I91: =H91/1200/65536 -> 2.609116605122884 | J91: =I91*LOG(2,10) -> 0.785422360326963 | K91: =POWER(2, I91) -> 6.1012997276710594 | M91: 63558880 | N91: =M91/655360 -> 96.983154296875 | P91: =255-A91 -> 216 | Q91: =-LOG(92544,2)/(LOG(P91,2)-8) -> 67.30726496024603 | R91: =174592/33513982*Q91 -> 0.35063902594264312 | S91: =LOG(R91,2)*1200*65536 -> -118903919.23870464 | U91: =A91*2+1 -> 79 | V91: =92544/U91 -> 1171.4430379746836 | W91: =174592/33513982*V91 -> 6.1026643412912245 | X91: =LOG(W91,2)*1200*65536 -> 205214652.15628111 | Z91: -26240 | AA91: =(92544+Z91)/92544 * 100 -> 71.645919778699863 | AB91: =AA91*655360 -> 46953869.986168742
A92: 38 | C92: -130050012 | D92: =C92/1200/65536 -> -1.653671417236328 | E92: =D92*LOG(2,10) -> -0.49780469956030138 | F92: =POWER(2, D92) -> 0.31783030191061679 | H92: 208059369 | I92: =H92/1200/65536 -> 2.6456116867065429 | J92: =I92*LOG(2,10) -> 0.79640847457784847 | K92: =POWER(2, I92) -> 6.2576097398241179 | M92: 63501367 | N92: =M92/655360 -> 96.895396423339847 | P92: =255-A92 -> 217 | Q92: =-LOG(92544,2)/(LOG(P92,2)-8) -> 69.188245366417135 | R92: =174592/33513982*Q92 -> 0.36043804448583577 | S92: =LOG(R92,2)*1200*65536 -> -115776694.37900726 | U92: =A92*2+1 -> 77 | V92: =92544/U92 -> 1201.8701298701299 | W92: =174592/33513982*V92 -> 6.2611751034026843 | X92: =LOG(W92,2)*1200*65536 -> 208123995.01414537 | Z92: -26880 | AA92: =(92544+Z92)/92544 * 100 -> 70.954356846473033 | AB92: =AA92*655360 -> 46500647.302904569
A93: 37 | C93: -126389754 | D93: =C93/1200/65536 -> -1.6071288299560547 | E93: =D93*LOG(2,10) -> -0.48379398471313023 | F93: =POWER(2, D93) -> 0.32825096785265356 | H93: 211042828 | I93: =H93/1200/65536 -> 2.6835483296712241 | J93: =I93*LOG(2,10) -> 0.80782854204501242 | K93: =POWER(2, I93) -> 6.4243403651500461 | M93: 63454951 | N93: =M93/655360 -> 96.824571228027338 | P93: =255-A93 -> 218 | Q93: =-LOG(92544,2)/(LOG(P93,2)-8) -> 71.167973524980098 | R93: =174592/33513982*Q93 -> 0.37075149212866809 | S93: =LOG(R93,2)*1200*65536 -> -112575821.58479623 | U93: =A93*2+1 -> 75 | V93: =92544/U93 -> 1233.92 | W93: =174592/33513982*V93 -> 6.4281397728267562 | X93: =LOG(W93,2)*1200*65536 -> 211109908.25091696 | Z93: -27392 | AA93: =(92544+Z93)/92544 * 100 -> 70.401106500691569 | AB93: =AA93*655360 -> 46138069.156293228
A94: 36 | C94: -124602974 | D94: =C94/1200/65536 -> -1.5844087473551431 | E94: =D94*LOG(2,10) -> -0.47695455834629252 | F94: =POWER(2, D94) -> 0.33346130208584329 | H94: 214129080 | I94: =H94/1200/65536 -> 2.7227920532226562 | J94: =I94*LOG(2,10) -> 0.81964207997553851 | K94: =POWER(2, I94) -> 6.6014916755480098 | M94: 63396416 | N94: =M94/655360 -> 96.735253906249994 | P94: =255-A94 -> 219 | Q94: =-LOG(92544,2)/(LOG(P94,2)-8) -> 73.254457793301356 | R94: =174592/33513982*Q94 -> 0.38162108862647448 | S94: =LOG(R94,2)*1200*65536 -> -109297312.49790838 | U94: =A94*2+1 -> 73 | V94: =92544/U94 -> 1267.7260273972602 | W94: =174592/33513982*V94 -> 6.6042531912603648 | X94: =LOG(W94,2)*1200*65536 -> 214176531.54240966 | Z94: -28032 | AA94: =(92544+Z94)/92544 * 100 -> 69.709543568464724 | AB94: =AA94*655360 -> 45684846.47302904
A95: 35 | C95: -121111679 | D95: =C95/1200/65536 -> -1.5400146357218425 | E95: =D95*LOG(2,10) -> -0.46359059911381373 | F95: =POWER(2, D95) -> 0.34388196593465215 | H95: 217307883 | I95: =H95/1200/65536 -> 2.7632126235961914 | J95: =I95*LOG(2,10) -> 0.83180988409981949 | K95: =POWER(2, I95) -> 6.7890637083688743 | M95: 63337297 | N95: =M95/655360 -> 96.645045471191409 | P95: =255-A95 -> 220 | Q95: =-LOG(92544,2)/(LOG(P95,2)-8) -> 75.456596324995843 | R95: =174592/33513982*Q95 -> 0.39309318915232672 | S95: =LOG(R95,2)*1200*65536 -> -105936851.62940982 | U95: =A95*2+1 -> 71 | V95: =92544/U95 -> 1303.4366197183099 | W95: =174592/33513982*V95 -> 6.7902884924226301 | X95: =LOG(W95,2)*1200*65536 -> 217328349.62269202 | Z95: -28672 | AA95: =(92544+Z95)/92544 * 100 -> 69.017980636237894 | AB95: =AA95*655360 -> 45231623.789764866
A96: 34 | C96: -117724617 | D96: =C96/1200/65536 -> -1.496945915222168 | E96: =D96*LOG(2,10) -> -0.45062562236854353 | F96: =POWER(2, D96) -> 0.35430263122713079 | H96: 220569385 | I96: =H96/1200/65536 -> 2.8046847661336263 | J96: =I96*LOG(2,10) -> 0.84429424298803946 | K96: =POWER(2, I96) -> 6.9870563045096858 | M96: 63277583 | N96: =M96/655360 -> 96.553929138183591 | P96: =255-A96 -> 221 | Q96: =-LOG(92544,2)/(LOG(P96,2)-8) -> 77.78430418403002 | R96: =174592/33513982*Q96 -> 0.40521944650140851 | S96: =LOG(R96,2)*1200*65536 -> -102489759.47505096 | U96: =A96*2+1 -> 69 | V96: =92544/U96 -> 1341.2173913043478 | W96: =174592/33513982*V96 -> 6.9871084487247348 | X96: =LOG(W96,2)*1200*65536 -> 220570231.73202574 | Z96: -29312 | AA96: =(92544+Z96)/92544 * 100 -> 68.326417704011064 | AB96: =AA96*655360 -> 44778401.106500693
A97: 33 | C97: -114435744 | D97: =C97/1200/65536 -> -1.4551257324218749 | E97: =D97*LOG(2,10) -> -0.43803649292150437 | F97: =POWER(2, D97) -> 0.36472329864781983 | H97: 223904178 | I97: =H97/1200/65536 -> 2.847088851928711 | J97: =I97*LOG(2,10) -> 0.85705914475106892 | K97: =POWER(2, I97) -> 7.1954696342621816 | M97: 63217262 | N97: =M97/655360 -> 96.46188659667969 | P97: =255-A97 -> 222 | Q97: =-LOG(92544,2)/(LOG(P97,2)-8) -> 80.248662890720311 | R97: =174592/33513982*Q97 -> 0.41805759015495803 | S97: =LOG(R97,2)*1200*65536 -> -98950950.283324048 | U97: =A97*2+1 -> 67 | V97: =92544/U97 -> 1381.2537313432836 | W97: =174592/33513982*V97 -> 7.1956788501792044 | X97: =LOG(W97,2)*1200*65536 -> 223907476.86831391 | Z97: -29952 | AA97: =(92544+Z97)/92544 * 100 -> 67.634854771784234 | AB97: =AA97*655360 -> 44325178.423236519
A98: 32 | C98: -111239528 | D98: =C98/1200/65536 -> -1.4144837443033855 | E98: =D98*LOG(2,10) -> -0.42580203541441997 | F98: =POWER(2, D98) -> 0.37514396526507765 | H98: 227303321 | I98: =H98/1200/65536 -> 2.8903111902872722 | J98: =I98*LOG(2,10) -> 0.87007036507973379 | K98: =POWER(2, I98) -> 7.4143035929078902 | M98: 63156320 | N98: =M98/655360 -> 96.368896484375 | P98: =255-A98 -> 223 | Q98: =-LOG(92544,2)/(LOG(P98,2)-8) -> 82.862097157898972 | R98: =174592/33513982*Q98 -> 0.43167234699212698 | S98: =LOG(R98,2)*1200*65536 -> -95314883.517926857 | U98: =A98*2+1 -> 65 | V98: =92544/U98 -> 1423.7538461538461 | W98: =174592/33513982*V98 -> 7.4170843532616413 | X98: =LOG(W98,2)*1200*65536 -> 227345865.89776328 | Z98: -30592 | AA98: =(92544+Z98)/92544 * 100 -> 66.943291839557389 | AB98: =AA98*655360 -> 43871955.739972331
A99: 31 | C99: -106607940 | D99: =C99/1200/65536 -> -1.3555900573730468 | E99: =D99*LOG(2,10) -> -0.40807326909314423 | F99: =POWER(2, D99) -> 0.39077496324268152 | H99: 230835683 | I99: =H99/1200/65536 -> 2.9352274958292641 | J99: =I99*LOG(2,10) -> 0.88359152034228161 | K99: =POWER(2, I99) -> 7.6487685653857218 | M99: 63082353 | N99: =M99/655360 -> 96.256031799316403 | P99: =255-A99 -> 224 | Q99: =-LOG(92544,2)/(LOG(P99,2)-8) -> 85.638584765109954 | R99: =174592/33513982*Q99 -> 0.44613653463530761 | S99: =LOG(R99,2)*1200*65536 -> -91575507.849905565 | U99: =A99*2+1 -> 63 | V99: =92544/U99 -> 1468.952380952381 | W99: =174592/33513982*V99 -> 7.6525473486032807 | X99: =LOG(W99,2)*1200*65536 -> 230891721.81153405 | Z99: -31360 | AA99: =(92544+Z99)/92544 * 100 -> 66.113416320885193 | AB99: =AA99*655360 -> 43328088.520055324
A100: 30 | C100: -103622027 | D100: =C100/1200/65536 -> -1.317622210184733 | E100: =D100*LOG(2,10) -> -0.39664380821867545 | F100: =POWER(2, D100) -> 0.40119562809191278 | H100: 234560942 | I100: =H100/1200/65536 -> 2.9825966135660806 | J100: =I100*LOG(2,10) -> 0.89785104564920204 | K100: =POWER(2, I100) -> 7.9040748749103082 | M100: 63007453 | N100: =M100/655360 -> 96.141743469238278 | P100: =255-A100 -> 225 | Q100: =-LOG(92544,2)/(LOG(P100,2)-8) -> 88.593907053606543 | R100: =174592/33513982*Q100 -> 0.46153236641063045 | S100: =LOG(R100,2)*1200*65536 -> -87726196.255797923 | U100: =A100*2+1 -> 61 | V100: =92544/U100 -> 1517.1147540983607 | W100: =174592/33513982*V100 -> 7.9034505403607653 | X100: =LOG(W100,2)*1200*65536 -> 234551979.70589703 | Z100: -32128 | AA100: =(92544+Z100)/92544 * 100 -> 65.283540802212997 | AB100: =AA100*655360 -> 42784221.30013831
A101: 29 | C101: -100712684 | D101: =C101/1200/65536 -> -1.2806280008951823 | E101: =D101*LOG(2,10) -> -0.38550744155664957 | F101: =POWER(2, D101) -> 0.41161629427229374 | H101: 238312575 | I101: =H101/1200/65536 -> 3.0303010940551758 | J101: =I101*LOG(2,10) -> 0.91221152520398685 | K101: =POWER(2, I101) -> 8.1698018857857093 | M101: 62931594 | N101: =M101/655360 -> 96.025991821289068 | P101: =255-A101 -> 226 | Q101: =-LOG(92544,2)/(LOG(P101,2)-8) -> 91.745949520339224 | R101: =174592/33513982*Q101 -> 0.47795301730051254 | S101: =LOG(R101,2)*1200*65536 -> -83759670.471125603 | U101: =A101*2+1 -> 59 | V101: =92544/U101 -> 1568.542372881356 | W101: =174592/33513982*V101 -> 8.1713641180001133 | X101: =LOG(W101,2)*1200*65536 -> 238334268.43174946 | Z101: -32896 | AA101: =(92544+Z101)/92544 * 100 -> 64.453665283540801 | AB101: =AA101*655360 -> 42240354.080221295
A102: 28 | C102: -97876083 | D102: =C102/1200/65536 -> -1.2445587539672851 | E102: =D102*LOG(2,10) -> -0.3746495163103416 | F102: =POWER(2, D102) -> 0.4220369576742708 | H102: 242224086 | I102: =H102/1200/65536 -> 3.0800385284423828 | J102: =I102*LOG(2,10) -> 0.92718398486190534 | K102: =POWER(2, I102) -> 8.4563701562923637 | M102: 62854752 | N102: =M102/655360 -> 95.908740234375003 | P102: =255-A102 -> 227 | Q102: =-LOG(92544,2)/(LOG(P102,2)-8) -> 95.115064603798544 | R102: =174592/33513982*Q102 -> 0.49550451388636524 | S102: =LOG(R102,2)*1200*65536 -> -79667912.632884681 | U102: =A102*2+1 -> 57 | V102: =92544/U102 -> 1623.578947368421 | W102: =174592/33513982*V102 -> 8.458078648456258 | X102: =LOG(W102,2)*1200*65536 -> 242247006.329362 | Z102: -33664 | AA102: =(92544+Z102)/92544 * 100 -> 63.623789764868597 | AB102: =AA102*655360 -> 41696486.860304281
A103: 27 | C103: -92407161 | D103: =C103/1200/65536 -> -1.1750178146362305 | E103: =D103*LOG(2,10) -> -0.35371560764504506 | F103: =POWER(2, D103) -> 0.44287829078326119 | H103: 246275368 | I103: =H103/1200/65536 -> 3.131553243001302 | J103: =I103*LOG(2,10) -> 0.94269145916220798 | K103: =POWER(2, I103) -> 8.7637798460589273 | M103: 62776901 | N103: =M103/655360 -> 95.789949035644526 | P103: =255-A103 -> 228 | Q103: =-LOG(92544,2)/(LOG(P103,2)-8) -> 98.72451220967254 | R103: =174592/33513982*Q103 -> 0.51430802927897812 | S103: =LOG(R103,2)*1200*65536 -> -75442061.412220046 | U103: =A103*2+1 -> 55 | V103: =92544/U103 -> 1682.6181818181817 | W103: =174592/33513982*V103 -> 8.7656451447637576 | X103: =LOG(W103,2)*1200*65536 -> 246299514.06866011 | Z103: -34432 | AA103: =(92544+Z103)/92544 * 100 -> 62.793914246196401 | AB103: =AA103*655360 -> 41152619.640387274
A104: 26 | C104: -89768480 | D104: =C104/1200/65536 -> -1.1414652506510417 | E104: =D104*LOG(2,10) -> -0.34361527945406822 | F104: =POWER(2, D104) -> 0.45329895779170387 | H104: 250512337 | I104: =H104/1200/65536 -> 3.1854290898640949 | J104: =I104*LOG(2,10) -> 0.95890970510970786 | K104: =POWER(2, I104) -> 9.0972411071084274 | M104: 62684763 | N104: =M104/655360 -> 95.649357604980466 | P104: =255-A104 -> 229 | Q104: =-LOG(92544,2)/(LOG(P104,2)-8) -> 102.60099813108609 | R104: =174592/33513982*Q104 -> 0.53450268803338796 | S104: =LOG(R104,2)*1200*65536 -> -71072289.25095132 | U104: =A104*2+1 -> 53 | V104: =92544/U104 -> 1746.1132075471698 | W104: =174592/33513982*V104 -> 9.0964242068303154 | X104: =LOG(W104,2)*1200*65536 -> 250502148.39901802 | Z104: -35328 | AA104: =(92544+Z104)/92544 * 100 -> 61.825726141078839 | AB104: =AA104*655360 -> 40518107.883817427
A105: 25 | C105: -80988332 | D105: =C105/1200/65536 -> -1.0298198954264324 | E105: =D105*LOG(2,10) -> -0.31000667865490045 | F105: =POWER(2, D105) -> 0.48977128752381754 | H105: 254847221 | I105: =H105/1200/65536 -> 3.2405499903361004 | J105: =I105*LOG(2,10) -> 0.97550274953979044 | K105: =POWER(2, I105) -> 9.4515437624077236 | M105: 62604633 | N105: =M105/655360 -> 95.527088928222653 | P105: =255-A105 -> 230 | Q105: =-LOG(92544,2)/(LOG(P105,2)-8) -> 106.77533671965558 | R105: =174592/33513982*Q105 -> 0.55624901835174667 | S105: =LOG(R105,2)*1200*65536 -> -66547656.420361519 | U105: =A105*2+1 -> 51 | V105: =92544/U105 -> 1814.5882352941176 | W105: =174592/33513982*V105 -> 9.4531467247452294 | X105: =LOG(W105,2)*1200*65536 -> 254866461.63758993 | Z105: -36096 | AA105: =(92544+Z105)/92544 * 100 -> 60.995850622406643 | AB105: =AA105*655360 -> 39974240.66390042
A106: 24 | C106: -80988332 | D106: =C106/1200/65536 -> -1.0298198954264324 | E106: =D106*LOG(2,10) -> -0.31000667865490045 | F106: =POWER(2, D106) -> 0.48977128752381754 | H106: 259383700 | I106: =H106/1200/65536 -> 3.2982343037923179 | J106: =I106*LOG(2,10) -> 0.99286745816939526 | K106: =POWER(2, I106) -> 9.8371084237077362 | M106: 62509758 | N106: =M106/655360 -> 95.382321166992185 | P106: =255-A106 -> 231 | Q106: =-LOG(92544,2)/(LOG(P106,2)-8) -> 111.28327259759119 | R106: =174592/33513982*Q106 -> 0.57973323281484845 | S106: =LOG(R106,2)*1200*65536 -> -61855936.444251537 | U106: =A106*2+1 -> 49 | V106: =92544/U106 -> 1888.6530612244899 | W106: =174592/33513982*V106 -> 9.8389894482042184 | X106: =LOG(W106,2)*1200*65536 -> 259405393.07860151 | Z106: -36992 | AA106: =(92544+Z106)/92544 * 100 -> 60.027662517289073 | AB106: =AA106*655360 -> 39339728.907330565
A107: 23 | C107: -76260225 | D107: =C107/1200/65536 -> -0.96969890594482422 | E107: =D107*LOG(2,10) -> -0.29190845745193772 | F107: =POWER(2, D107) -> 0.51061261786160683 | H107: 264149819 | I107: =H107/1200/65536 -> 3.3588386408487954 | J107: =I107*LOG(2,10) -> 1.0111111814907252 | K107: =POWER(2, I107) -> 10.259145317246277 | M107: 62399437 | N107: =M107/655360 -> 95.213984680175784 | P107: =255-A107 -> 232 | Q107: =-LOG(92544,2)/(LOG(P107,2)-8) -> 116.16650779781689 | R107: =174592/33513982*Q107 -> 0.60517257929649915 | S107: =LOG(R107,2)*1200*65536 -> -56983405.867316753 | U107: =A107*2+1 -> 47 | V107: =92544/U107 -> 1969.0212765957447 | W107: =174592/33513982*V107 -> 10.257669850255462 | X107: =LOG(W107,2)*1200*65536 -> 264133500.31106791 | Z107: -38016 | AA107: =(92544+Z107)/92544 * 100 -> 58.921161825726145 | AB107: =AA107*655360 -> 38614572.614107884
A108: 22 | C108: -71721294 | D108: =C108/1200/65536 -> -0.9119834136962891 | E108: =D108*LOG(2,10) -> -0.27453436307061663 | F108: =POWER(2, D108) -> 0.53145394713713656 | H108: 269055358 | I108: =H108/1200/65536 -> 3.421215794881185 | J108: =I108*LOG(2,10) -> 1.0298885758986269 | K108: =POWER(2, I108) -> 10.71244427784581 | M108: 62287025 | N108: =M108/655360 -> 95.042457580566406 | P108: =255-A108 -> 233 | Q108: =-LOG(92544,2)/(LOG(P108,2)-8) -> 121.47399685367226 | R108: =174592/33513982*Q108 -> 0.63282208776851245 | S108: =LOG(R108,2)*1200*65536 -> -51914589.256945349 | U108: =A108*2+1 -> 45 | V108: =92544/U108 -> 2056.5333333333333 | W108: =174592/33513982*V108 -> 10.713566288044593 | X108: =LOG(W108,2)*1200*65536 -> 269067240.86604875 | Z108: -39040 | AA108: =(92544+Z108)/92544 * 100 -> 57.814661134163217 | AB108: =AA108*655360 -> 37889416.320885204
A109: 21 | C109: -67356980 | D109: =C109/1200/65536 -> -0.85648829142252603 | E109: =D109*LOG(2,10) -> -0.25782866665317361 | F109: =POWER(2, D109) -> 0.55229528210392098 | H109: 274233055 | I109: =H109/1200/65536 -> 3.4870536168416342 | J109: =I109*LOG(2,10) -> 1.0497077351579069 | K109: =POWER(2, I109) -> 11.21263629538376 | M109: 62172440 | N109: =M109/655360 -> 94.86761474609375 | P109: =255-A109 -> 234 | Q109: =-LOG(92544,2)/(LOG(P109,2)-8) -> 127.26359509489787 | R109: =174592/33513982*Q109 -> 0.66298315714343958 | S109: =LOG(R109,2)*1200*65536 -> -46631947.488443568 | U109: =A109*2+1 -> 43 | V109: =92544/U109 -> 2152.1860465116279 | W109: =174592/33513982*V109 -> 11.211871696790853 | X109: =LOG(W109,2)*1200*65536 -> 274225317.93433464 | Z109: -40064 | AA109: =(92544+Z109)/92544 * 100 -> 56.708160442600274 | AB109: =AA109*655360 -> 37164260.027662516
A110: 20 | C110: -61110000 | D110: =C110/1200/65536 -> -0.7770538330078125 | E110: =D110*LOG(2,10) -> -0.23391651198102173 | F110: =POWER(2, D110) -> 0.58355727553148884 | H110: 279638071 | I110: =H110/1200/65536 -> 3.5557819493611653 | J110: =I110*LOG(2,10) -> 1.0703970247982539 | K110: =POWER(2, I110) -> 11.759721178587629 | M110: 62055598 | N110: =M110/655360 -> 94.689328002929685 | P110: =255-A110 -> 235 | Q110: =-LOG(92544,2)/(LOG(P110,2)-8) -> 133.60417788531137 | R110: =174592/33513982*Q110 -> 0.69601459550083555 | S110: =LOG(R110,2)*1200*65536 -> -41115493.468169242 | U110: =A110*2+1 -> 41 | V110: =92544/U110 -> 2257.1707317073169 | W110: =174592/33513982*V110 -> 11.758792267366017 | X110: =LOG(W110,2)*1200*65536 -> 279629108.48174173 | Z110: -41088 | AA110: =(92544+Z110)/92544 * 100 -> 55.601659751037346 | AB110: =AA110*655360 -> 36439103.734439835
A111: 19 | C111: -57128603 | D111: =C111/1200/65536 -> -0.72642775217692057 | E111: =D111*LOG(2,10) -> -0.21867654308801396 | F111: =POWER(2, D111) -> 0.60439861005181017 | H111: 285276599 | I111: =H111/1200/65536 -> 3.6274795405069988 | J111: =I111*LOG(2,10) -> 1.0919801503500022 | K111: =POWER(2, I111) -> 12.358909451298972 | M111: 61921338 | N111: =M111/655360 -> 94.48446350097656 | P111: =255-A111 -> 236 | Q111: =-LOG(92544,2)/(LOG(P111,2)-8) -> 140.57839563178791 | R111: =174592/33513982*Q111 -> 0.73234697238141122 | S111: =LOG(R111,2)*1200*65536 -> -35342314.030948676 | U111: =A111*2+1 -> 39 | V111: =92544/U111 -> 2372.9230769230771 | W111: =174592/33513982*V111 -> 12.361807255436071 | X111: =LOG(W111,2)*1200*65536 -> 285303198.51289511 | Z111: -42240 | AA111: =(92544+Z111)/92544 * 100 -> 54.356846473029044 | AB111: =AA111*655360 -> 35623302.904564314
A112: 18 | C112: -51406812 | D112: =C112/1200/65536 -> -0.65367141723632816 | E112: =D112*LOG(2,10) -> -0.19677470389632026 | F112: =POWER(2, D112) -> 0.63566060382123357 | H112: 291285022 | I112: =H112/1200/65536 -> 3.70388058980306 | J112: =I112*LOG(2,10) -> 1.114979157888319 | K112: =POWER(2, I112) -> 13.031042400205548 | M112: 61783967 | N112: =M112/655360 -> 94.274851989746097 | P112: =255-A112 -> 237 | Q112: =-LOG(92544,2)/(LOG(P112,2)-8) -> 148.28629879605668 | R112: =174592/33513982*Q112 -> 0.77250150338450163 | S112: =LOG(R112,2)*1200*65536 -> -29285969.103634309 | U112: =A112*2+1 -> 37 | V112: =92544/U112 -> 2501.1891891891892 | W112: =174592/33513982*V112 -> 13.030013053027208 | X112: =LOG(W112,2)*1200*65536 -> 291276059.36749202 | Z112: -43392 | AA112: =(92544+Z112)/92544 * 100 -> 53.11203319502075 | AB112: =AA112*655360 -> 34807502.0746888
A113: 17 | C113: -45076827 | D113: =C113/1200/65536 -> -0.57318149566650389 | E113: =D113*LOG(2,10) -> -0.1725448231551619 | F113: =POWER(2, D113) -> 0.67213293527686913 | H113: 297593553 | I113: =H113/1200/65536 -> 3.7840977096557618 | J113: =I113*LOG(2,10) -> 1.1391269171297549 | K113: =POWER(2, I113) -> 13.776119999482125 | M113: 61627505 | N113: =M113/655360 -> 94.036109924316406 | P113: =255-A113 -> 238 | Q113: =-LOG(92544,2)/(LOG(P113,2)-8) -> 156.85017124376506 | R113: =174592/33513982*Q113 -> 0.81711522963136485 | S113: =LOG(R113,2)*1200*65536 -> -22915728.270290241 | U113: =A113*2+1 -> 35 | V113: =92544/U113 -> 2644.1142857142859 | W113: =174592/33513982*V113 -> 13.774585227485906 | X113: =LOG(W113,2)*1200*65536 -> 297580912.13311625 | Z113: -44672 | AA113: =(92544+Z113)/92544 * 100 -> 51.72890733056709 | AB113: =AA113*655360 -> 33901056.708160445
A114: 16 | C114: -39081417 | D114: =C114/1200/65536 -> -0.49694591522216797 | E114: =D114*LOG(2,10) -> -0.14959562670456236 | F114: =POWER(2, D114) -> 0.7086052624542617 | H114: 304259679 | I114: =H114/1200/65536 -> 3.868861885070801 | J114: =I114*LOG(2,10) -> 1.1646434764874052 | K114: =POWER(2, I114) -> 14.609773281588396 | M114: 61450490 | N114: =M114/655360 -> 93.766006469726563 | P114: =255-A114 -> 239 | Q114: =-LOG(92544,2)/(LOG(P114,2)-8) -> 166.42106948142498 | R114: =174592/33513982*Q114 -> 0.86697508409776403 | S114: =LOG(R114,2)*1200*65536 -> -16195588.89944537 | U114: =A114*2+1 -> 33 | V114: =92544/U114 -> 2804.3636363636365 | W114: =174592/33513982*V114 -> 14.609408574606265 | X114: =LOG(W114,2)*1200*65536 -> 304256846.68379194 | Z114: -46080 | AA114: =(92544+Z114)/92544 * 100 -> 50.207468879668049 | AB114: =AA114*655360 -> 32903966.804979254
A115: 15 | C115: -32596328 | D115: =C115/1200/65536 -> -0.41448374430338542 | E115: =D115*LOG(2,10) -> -0.12477203975043878 | F115: =POWER(2, D115) -> 0.75028793053015541 | H115: 311356802 | I115: =H115/1200/65536 -> 3.9591064707438153 | J115: =I115*LOG(2,10) -> 1.1918098037212503 | K115: =POWER(2, I115) -> 15.552843563584736 | M115: 61268027 | N115: =M115/655360 -> 93.487590026855472 | P115: =255-A115 -> 240 | Q115: =-LOG(92544,2)/(LOG(P115,2)-8) -> 177.18781410721309 | R115: =174592/33513982*Q115 -> 0.92306473282126089 | S115: =LOG(R115,2)*1200*65536 -> -9082996.2557979096 | U115: =A115*2+1 -> 31 | V115: =92544/U115 -> 2985.2903225806454 | W115: =174592/33513982*V115 -> 15.55195106329054 | X115: =LOG(W115,2)*1200*65536 -> 311350291.01430553 | Z115: -47488 | AA115: =(92544+Z115)/92544 * 100 -> 48.686030428769016 | AB115: =AA115*655360 -> 31906876.901798062
A116: 14 | C116: -26461961 | D116: =C116/1200/65536 -> -0.33648123423258464 | E116: =D116*LOG(2,10) -> -0.10129094448204598 | F116: =POWER(2, D116) -> 0.79197059227764921 | H116: 318928386 | I116: =H116/1200/65536 -> 4.0553841400146489 | J116: =I116*LOG(2,10) -> 1.2207922700843876 | K116: =POWER(2, I116) -> 16.626172040582759 | M116: 61062357 | N116: =M116/655360 -> 93.173762512207034 | P116: =255-A116 -> 241 | Q116: =-LOG(92544,2)/(LOG(P116,2)-8) -> 189.3895778420827 | R116: =174592/33513982*Q116 -> 0.98663015259138409 | S116: =LOG(R116,2)*1200*65536 -> -1527149.9979191655 | U116: =A116*2+1 -> 29 | V116: =92544/U116 -> 3191.1724137931033 | W116: =174592/33513982*V116 -> 16.62449941248299 | X116: =LOG(W116,2)*1200*65536 -> 318916971.29530591 | Z116: -49024 | AA116: =(92544+Z116)/92544 * 100 -> 47.026279391424616 | AB116: =AA116*655360 -> 30819142.461964037
A117: 13 | C117: -19232883 | D117: =C117/1200/65536 -> -0.24455875396728516 | E117: =D117*LOG(2,10) -> -7.3619520646360487E-2 | F117: =POWER(2, D117) -> 0.84407391534854159 | H117: 327023727 | I117: =H117/1200/65536 -> 4.1583217239379886 | J117: =I117*LOG(2,10) -> 1.2517795705264914 | K117: =POWER(2, I117) -> 17.855810595446698 | M117: 60831190 | N117: =M117/655360 -> 92.821029663085937 | P117: =255-A117 -> 242 | Q117: =-LOG(92544,2)/(LOG(P117,2)-8) -> 203.33386843132607 | R117: =174592/33513982*Q117 -> 1.0592733133640186 | S117: =LOG(R117,2)*1200*65536 -> 6533274.4875966106 | U117: =A117*2+1 -> 27 | V117: =92544/U117 -> 3427.5555555555557 | W117: =174592/33513982*V117 -> 17.855943813407656 | X117: =LOG(W117,2)*1200*65536 -> 327024573.48118055 | Z117: -50688 | AA117: =(92544+Z117)/92544 * 100 -> 45.228215767634858 | AB117: =AA117*655360 -> 29640763.485477179
A118: 12 | C118: -11779220 | D118: =C118/1200/65536 -> -0.14978052775065104 | E118: =D118*LOG(2,10) -> -4.5088431619327289E-2 | F118: =POWER(2, D118) -> 0.90138757718230211 | H118: 335750680 | I118: =H118/1200/65536 -> 4.2692906697591146 | J118: =I118*LOG(2,10) -> 1.2851845518058613 | K118: =POWER(2, I118) -> 19.283441817098481 | M118: 60571730 | N118: =M118/655360 -> 92.425125122070313 | P118: =255-A118 -> 243 | Q118: =-LOG(92544,2)/(LOG(P118,2)-8) -> 219.42281134685658 | R118: =174592/33513982*Q118 -> 1.1430890987131992 | S118: =LOG(R118,2)*1200*65536 -> 15173250.680059336 | U118: =A118*2+1 -> 25 | V118: =92544/U118 -> 3701.76 | W118: =174592/33513982*V118 -> 19.284419318480268 | X118: =LOG(W118,2)*1200*65536 -> 335756431.18763095 | Z118: -52480 | AA118: =(92544+Z118)/92544 * 100 -> 43.291839557399726 | AB118: =AA118*655360 -> 28371739.972337484
A119: 11 | C119: -3558600 | D119: =C119/1200/65536 -> -4.524993896484375E-2 | E119: =D119*LOG(2,10) -> -1.3621588930382325E-2 | F119: =POWER(2, D119) -> 0.96912190736136128 | H119: 345215908 | I119: =H119/1200/65536 -> 4.3896472676595053 | J119: =I119*LOG(2,10) -> 1.3214154979499475 | K119: =POWER(2, I119) -> 20.96116892522101 | M119: 60280531 | N119: =M119/655360 -> 91.980790710449213 | P119: =255-A119 -> 244 | Q119: =-LOG(92544,2)/(LOG(P119,2)-8) -> 238.19257384063539 | R119: =174592/33513982*Q119 -> 1.2408706865088193 | S119: =LOG(R119,2)*1200*65536 -> 24485778.736635864 | U119: =A119*2+1 -> 23 | V119: =92544/U119 -> 4023.6521739130435 | W119: =174592/33513982*V119 -> 20.961325346174206 | X119: =LOG(W119,2)*1200*65536 -> 345216754.66873974 | Z119: -54400 | AA119: =(92544+Z119)/92544 * 100 -> 41.217150760719221 | AB119: =AA119*655360 -> 27012071.922544949
A120: 10 | C120: 5804083 | D120: =C120/1200/65536 -> 7.3802731831868487E-2 | E120: =D120*LOG(2,10) -> 2.2216836043337334E-2 | F120: =POWER(2, D120) -> 1.0524872321078316 | H120: 355533720 | I120: =H120/1200/65536 -> 4.5208450317382809 | J120: =I120*LOG(2,10) -> 1.3609099603017054 | K120: =POWER(2, I120) -> 22.956726505806142 | M120: 59932235 | N120: =M120/655360 -> 91.449333190917969 | P120: =255-A120 -> 245 | Q120: =-LOG(92544,2)/(LOG(P120,2)-8) -> 260.37429302719119 | R120: =174592/33513982*Q120 -> 1.3564269554182897 | S120: =LOG(R120,2)*1200*65536 -> 34588172.709825389 | U120: =A120*2+1 -> 21 | V120: =92544/U120 -> 4406.8571428571431 | W120: =174592/33513982*V120 -> 22.957642045809845 | X120: =LOG(W120,2)*1200*65536 -> 355538244.74824804 | Z120: -56576 | AA120: =(92544+Z120)/92544 * 100 -> 38.865836791147998 | AB120: =AA120*655360 -> 25471114.799446754
A121: 9 | C121: 15488854 | D121: =C121/1200/65536 -> 0.19695096333821616 | E121: =D121*LOG(2,10) -> 5.9288147639720117E-2 | F121: =POWER(2, D121) -> 1.146273223670516 | H121: 366893909 | I121: =H121/1200/65536 -> 4.6652973047892257 | J121: =I121*LOG(2,10) -> 1.4043944274318836 | K121: =POWER(2, I121) -> 25.37432087072596 | M121: 59539694 | N121: =M121/655360 -> 90.850363159179693 | P121: =255-A121 -> 246 | Q121: =-LOG(92544,2)/(LOG(P121,2)-8) -> 286.9915608156474 | R121: =174592/33513982*Q121 -> 1.4950903353091707 | S121: =LOG(R121,2)*1200*65536 -> 45631352.857483521 | U121: =A121*2+1 -> 19 | V121: =92544/U121 -> 4870.7368421052633 | W121: =174592/33513982*V121 -> 25.374235945368774 | X121: =LOG(W121,2)*1200*65536 -> 366893529.26607603 | Z121: -58880 | AA121: =(92544+Z121)/92544 * 100 -> 36.376210235131396 | AB121: =AA121*655360 -> 23839513.139695711
A122: 8 | C122: 26302571 | D122: =C122/1200/65536 -> 0.33445448557535806 | E122: =D122*LOG(2,10) -> 0.10068083234254908 | F122: =POWER(2, D122) -> 1.260900544715402 | H122: 379514591 | I122: =H122/1200/65536 -> 4.8257775751749676 | J122: =I122*LOG(2,10) -> 1.4527038025302579 | K122: =POWER(2, I122) -> 28.359841711314147 | M122: 59070709 | N122: =M122/655360 -> 90.134748840332037 | P122: =255-A122 -> 247 | Q122: =-LOG(92544,2)/(LOG(P122,2)-8) -> 319.52289879648089 | R122: =174592/33513982*Q122 -> 1.6645632245871347 | S122: =LOG(R122,2)*1200*65536 -> 57814050.586425804 | U122: =A122*2+1 -> 17 | V122: =92544/U122 -> 5443.7647058823532 | W122: =174592/33513982*V122 -> 28.35944017423569 | X122: =LOG(W122,2)*1200*65536 -> 379512984.57430393 | Z122: -61440 | AA122: =(92544+Z122)/92544 * 100 -> 33.609958506224068 | AB122: =AA122*655360 -> 22026622.406639006
A123: 7 | C123: 38724450 | D123: =C123/1200/65536 -> 0.49240684509277344 | E123: =D123*LOG(2,10) -> 0.14822923044319222 | F123: =POWER(2, D123) -> 1.4067898636862921 | H123: 393720274 | I123: =H123/1200/65536 -> 5.0064121754964193 | J123: =I123*LOG(2,10) -> 1.5070802354817896 | K123: =POWER(2, I123) -> 32.14254314137289 | M123: 58481109 | N123: =M123/655360 -> 89.235090637207037 | P123: =255-A123 -> 248 | Q123: =-LOG(92544,2)/(LOG(P123,2)-8) -> 360.1860892932076 | R123: =174592/33513982*Q123 -> 1.8763992205366613 | S123: =LOG(R123,2)*1200*65536 -> 71405415.168397188 | U123: =A123*2+1 -> 15 | V123: =92544/U123 -> 6169.6 | W123: =174592/33513982*V123 -> 32.140698864133782 | X123: =LOG(W123,2)*1200*65536 -> 393713763.80276281 | Z123: -64384 | AA123: =(92544+Z123)/92544 * 100 -> 30.428769017980635 | AB123: =AA123*655360 -> 19941798.06362379
A124: 6 | C124: 51807406 | D124: =C124/1200/65536 -> 0.65876523335774739 | E124: =D124*LOG(2,10) -> 0.19830809534126423 | F124: =POWER(2, D124) -> 1.5787308490423497 | H124: 409955006 | I124: =H124/1200/65536 -> 5.2128474680582686 | J124: =I124*LOG(2,10) -> 1.5692234507065757 | K124: =POWER(2, I124) -> 37.0871491374687 | M124: 57704707 | N124: =M124/655360 -> 88.050395202636722 | P124: =255-A124 -> 249 | Q124: =-LOG(92544,2)/(LOG(P124,2)-8) -> 412.46621874416695 | R124: =174592/33513982*Q124 -> 2.1487539756684715 | S124: =LOG(R124,2)*1200*65536 -> 86782795.501505524 | U124: =A124*2+1 -> 13 | V124: =92544/U124 -> 7118.7692307692305 | W124: =174592/33513982*V124 -> 37.085421766308208 | X124: =LOG(W124,2)*1200*65536 -> 409949721.4496091 | Z124: -67840 | AA124: =(92544+Z124)/92544 * 100 -> 26.694329183955741 | AB124: =AA124*655360 -> 17494395.573997233
A125: 5 | C125: 67517920 | D125: =C125/1200/65536 -> 0.85853474934895835 | E125: =D125*LOG(2,10) -> 0.25844471187389406 | F125: =POWER(2, D125) -> 1.8131958311668153 | H125: 428919689 | I125: =H125/1200/65536 -> 5.4539958826700845 | J125: =I125*LOG(2,10) -> 1.6418163569115465 | K125: =POWER(2, I125) -> 43.834530258668877 | M125: 56629761 | N125: =M125/655360 -> 86.410157775878901 | P125: =255-A125 -> 250 | Q125: =-LOG(92544,2)/(LOG(P125,2)-8) -> 482.17176446609415 | R125: =174592/33513982*Q125 -> 2.5118869104144146 | S125: =LOG(R125,2)*1200*65536 -> 104498843.85215163 | U125: =A125*2+1 -> 11 | V125: =92544/U125 -> 8413.0909090909099 | W125: =174592/33513982*V125 -> 43.828225723818797 | X125: =LOG(W125,2)*1200*65536 -> 428903369.62050593 | Z125: -71936 | AA125: =(92544+Z125)/92544 * 100 -> 22.268326417704014 | AB125: =AA125*655360 -> 14593770.401106503
A126: 4 | C126: 86119915 | D126: =C126/1200/65536 -> 1.0950713475545248 | E126: =D126*LOG(2,10) -> 0.32964932300608862 | F126: =POWER(2, D126) -> 2.136236459682344 | H126: 451681285 | I126: =H126/1200/65536 -> 5.7434245427449548 | J126: =I126*LOG(2,10) -> 1.7289430651989166 | K126: =POWER(2, I126) -> 53.572642066280977 | M126: 54984998 | N126: =M126/655360 -> 83.900448608398435 | P126: =255-A126 -> 251 | Q126: =-LOG(92544,2)/(LOG(P126,2)-8) -> 579.75798553377922 | R126: =174592/33513982*Q126 -> 3.020264981055178 | S126: =LOG(R126,2)*1200*65536 -> 125410355.10877384 | U126: =A126*2+1 -> 9 | V126: =92544/U126 -> 10282.666666666666 | W126: =174592/33513982*V126 -> 53.56783144022296 | X126: =LOG(W126,2)*1200*65536 -> 451671096.41789454 | Z126: -76928 | AA126: =(92544+Z126)/92544 * 100 -> 16.874135546334717 | AB126: =AA126*655360 -> 11058633.47164592
A127: 3 | C127: 108408649 | D127: =C127/1200/65536 -> 1.3784872563680013 | E127: =D127*LOG(2,10) -> 0.41496601280731271 | F127: =POWER(2, D127) -> 2.5999560867916758 | H127: 480197409 | I127: =H127/1200/65536 -> 6.1060258102416993 | J127: =I127*LOG(2,10) -> 1.8380969231812156 | K127: =POWER(2, I127) -> 68.880600269485669 | M127: 51858011 | N127: =M127/655360 -> 79.129045104980463 | P127: =255-A127 -> 252 | Q127: =-LOG(92544,2)/(LOG(P127,2)-8) -> 726.13539997942701 | R127: =174592/33513982*Q127 -> 3.7828220995406667 | S127: =LOG(R127,2)*1200*65536 -> 150952707.11191133 | U127: =A127*2+1 -> 7 | V127: =92544/U127 -> 13220.571428571429 | W127: =174592/33513982*V127 -> 68.872926137429531 | X127: =LOG(W127,2)*1200*65536 -> 480184767.68496209 | Z127: -83328 | AA127: =(92544+Z127)/92544 * 100 -> 9.9585062240663902 | AB127: =AA127*655360 -> 6526406.6390041495
A128: 2 | C128: 136998085 | D128: =C128/1200/65536 -> 1.7420207341512044 | E128: =D128*LOG(2,10) -> 0.52440049404810229 | F128: =POWER(2, D128) -> 3.3450336735274568 | H128: 518372928 | I128: =H128/1200/65536 -> 6.59145263671875 | J128: =I128*LOG(2,10) -> 1.9842249586507823 | K128: =POWER(2, I128) -> 96.432840330945481 | M128: 30609294 | N128: =M128/655360 -> 46.706076049804686 | P128: =255-A128 -> 253 | Q128: =-LOG(92544,2)/(LOG(P128,2)-8) -> 970.09521639045636 | R128: =174592/33513982*Q128 -> 5.0537373929496816 | S128: =LOG(R128,2)*1200*65536 -> 183816738.53526434 | U128: =A128*2+1 -> 5 | V128: =92544/U128 -> 18508.8 | W128: =174592/33513982*V128 -> 96.422096592401331 | X128: =LOG(W128,2)*1200*65536 -> 518360286.73947674 | Z128: -92288 | AA128: =(92544+Z128)/92544 * 100 -> 0.27662517289073307 | AB128: =AA128*655360 -> 181289.07330567081
A129: 1 | C129: 177076301 | D129: =C129/1200/65536 -> 2.2516416041056315 | E129: =D129*LOG(2,10) -> 0.67781166232075785 | F129: =POWER(2, D129) -> 4.7622442085390073 | H129: 576335164 | I129: =H129/1200/65536 -> 7.3284805806477866 | J129: =I129*LOG(2,10) -> 2.2060924774159734 | K129: =POWER(2, I129) -> 160.72834668881589 | M129: 26499231 | N129: =M129/655360 -> 40.434617614746095 | P129: =255-A129 -> 254 | Q129: =-LOG(92544,2)/(LOG(P129,2)-8) -> 1458.011060300953 | R129: =174592/33513982*Q129 -> 7.5955482413299613 | S129: =LOG(R129,2)*1200*65536 -> 230043479.01141542 | U129: =A129*2+1 -> 3 | V129: =92544/U129 -> 30848 | W129: =174592/33513982*V129 -> 160.70349432066891 | X129: =LOG(W129,2)*1200*65536 -> 576317619.35460865 | Z129: -92416 | AA129: =(92544+Z129)/92544 * 100 -> 0.13831258644536654 | AB129: =AA129*655360 -> 90644.536652835406
A130: 0 | C130: 244302133 | D130: =C130/1200/65536 -> 3.106462262471517 | E130: =D130*LOG(2,10) -> 0.93513832140212183 | F130: =POWER(2, D130) -> 8.6126801961258899 | H130: 700981687 | I130: =H130/1200/65536 -> 8.9134430821736661 | J130: =I130*LOG(2,10) -> 2.6832137323778813 | K130: =POWER(2, I130) -> 482.18504033540677 | M130: 0 | N130: =M130/655360 -> 0.00 | P130: =255-A130 -> 255 | Q130: =-LOG(92544,2)/(LOG(P130,2)-8) -> 2921.7510589306694 | R130: =174592/33513982*Q130 -> 15.220941542572392 | S130: =LOG(R130,2)*1200*65536 -> 308909364.94301909 | U130: =A130*2+1 -> 1 | V130: =92544/U130 -> 92544 | W130: =174592/33513982*V130 -> 482.1104829620067 | X130: =LOG(W130,2)*1200*65536 -> 700964142.29132259 | Z130: -92544 | AA130: =(92544+Z130)/92544 * 100 -> 0.00 | AB130: =AA130*655360 -> 0